App,Developer,Type,Rates,Downloads+,Last_reviews
El Poder de la mente,Emprendedora apps,Estilo de vida,4.4,100000,"Gauuu, que buena aplicaci칩n. Amo los temas de autosuperaci칩n, autoayuda, f칤sica cu치ntica, etc. Esta aplicaci칩n aborda este tipo de tem치tica, abordando items, como ley de atracci칩n, como influye tu mente, exito y decenas de items, de forma corta pero precisa, con conceptos con mucho fundamento. Yo la...Opini칩n completa"
Audios de Autoestima游눩Motivaci칩n游땏Superaci칩n仇벒잺,DAVID B MAR칈N,Educaci칩n,4.6,5000,"Muy buenos mensajes, positivos y con mucho empuje."
"Goalmap: motivaci칩n, bienestar, metas personales",GOALMAP,Productividad,3.3,100000,"Excelente aplicaci칩n para cumplir metas de h치bitos (Ej. Ejercicio, meditaci칩n, comida, etc). No tan bueno para metas de logros (Ej. ahorro mensual, ventas, viajes, etc). Ser칤a muy bueno agregarle funcionalidades b치sicas de OKRs."
Crecimiento Espiritual,Apps B칤blicas Cristianas Interesantes,Libros y obras de consulta,4.6,100000,"Muy buena aplicasion,lo que m치s me gusta es que viene ,respaldada con citas biblicas."
Mindfulness Meditaci칩n guiada,Metta Apps,Estilo de vida,4.1,100000,El contenido de la app es excepcional y muy 칰til. El problema que tengo es que escuchando los audios se me paran cada 2 min (cuando se apaga la pantalla del m칩vil) y tengo que cortar el ejercicio para coger el tlf y desbloquearlo para que contin칰e el audio de nuevo. No consigo disfrutar de forma con...Opini칩n completa
Autoayuda y Superaci칩n Libro 4,ImagenParaWeb,Estilo de vida,4.6,10000,Los libros son incre칤bles! Pero cuando intento leer los documentos pdf adicionales no aparecen...
Desarrollo Personal,PachaStudio,Estilo de vida,2.8,1000,no carga para nada k fea app
C칤ngulo: Terapia Guiada,C칤ngulo,Salud y bienestar,4.9,1000000,"Que lindooo. Lastima que no tenga traduccion! No puedo usarla, sovre todo porque son audios. Espero tener acceso algun dia!"
Como Ser Feliz,Wilson Castrillon,Estilo de vida,4.6,100000,"Una aplicaci칩n M츼GICA. Cada paso est치 lleno de palabras incre칤blemente reconfortantes. Esta aplicaci칩n me la descargu칠 hace unos meses en el m칩vil de mi madre cuando estaba pasando un mal momento, y me mejor칩 muchisimo todo. Algo en m칤 mejor칩. Pero se ve que no estaba del todo preparada para que mi ...Opini칩n completa"
PNL pr치ctico,Metta Apps,Estilo de vida,4.4,100000,"Definitivamente excelente, para quienes nos hemos capacitado en estos temas, no podemos negar que la app maneja la PNL muy simple, de una forma tan sencilla, solo es cuesti칩n de ser consciente y concentrarse en lo que te ense침a esta app... Felicidades!"
"Control y Monitor: Ansiedad, 츼nimo y Autoestima",TwoCats App,Estilo de vida,4.6,1000000,Este app es excelente! te ayuda a mantenerte relajado ante las ansiedades con las pr치cticas de respiraci칩n.!! Recomendado para todos quienes sufren Ansiedades y ataques de p치nico!! Llevo 10 a침os con el problema y por f칤n encontre un app que me ayude a paliar con este trastorno psicol칩gico. Saludos y...Opini칩n completa
Abundancia Reto,Metta Apps,Estilo de vida,4.5,100000,"Le he dado solo dos estrellas, me parece buen material pero lamentablemente los audios se paran, dejan de funcionar y de esta forma no se puede meditar dado a que se interrumpe, siempre me gusta respetar el trabajo de todo desarrollador y respeto este, es un buen trabajo pero el fallo com칰n son los ...Opini칩n completa"
游븿 Aumenta tu Sabidur칤a 游븿,Nerv Apps,Estilo de vida,4.4,100000,"La app en s칤 es buena, pero en mi opini칩n estar칤a mejor si pusieras las fechas ya que ayuda bastante a entender en qu칠 condiciones slo escribi칩 el autor."
Superaci칩n Personal - Librer칤a,Libro Movil,Libros y obras de consulta,3.7,100000,p칠sima!!!! el audio se traba constantemente. devuelvan mi dinero
La Mente es Maravillosa - Psicolog칤a y relaciones,Grupo MContigo,Noticias y revistas,4.7,100000,"Me gusta bastante los art칤culos, es informaci칩n que ayuda, adem치s, las dan expertos en el tema. La recomiendo para leer y saber temas de psicolog칤a, salud, familia entre otros."
Motivaci칩n Diaria: Una frase motivacional por d칤a,Meta Priori,Estilo de vida,4.4,100000,"Me gustar칤a que hubieran m치s frases pues ya se empezaron a repetir y me gusta mucho la app Excelentes frases, realmente te dejan pensando y reflexionando, interesante aplicaci칩n"
SkillMentor by Mentorist: SelfHelp Books In Action,Taulab O칖,Educaci칩n,4.5,10000,Very practical tool for habit creation
"Control y Monitor: Ansiedad, 츼nimo y Autoestima",TwoCats App,Estilo de vida,4.6,1000000,Es una aplicaci칩n s칰per guay cada d칤a me siento de un n칰mero diferente jejeje habitualmente me siento incre칤ble pero bueno da igual he tenido que evaluar este aplicaci칩n con cinco estrellas porque es la mejor aplicaci칩n de todas. He evaluado muchas y siempre digo que es la mejor aplicaci칩n de todas ...Opini칩n completa
Coaching Personal PRO,Metta Apps,Estilo de vida,4.9,11000,Buena
Mindfulness Meditaci칩n guiada,Metta Apps,Estilo de vida,4.1,100000,Seria bueno que agregar치n estad칤sticas semanales y estados de 치nimo. As칤 al finalizar la semana uno puede ver su gr치fica y ayuda a comparar que tan bien o no estuve durante la semana. Tambi칠n recordatorios seria de gran ayuda.
Curvas de Crecimiento Infantil,"ABQ App Source, LLC",Medicina,4.8,100000,"Las curvas son muy espec칤ficas en Geograf칤a, por lo general est치 bien para un seguimiento pero el m칠dico y enfermera van a usar los propios que tienen en la cartilla y puede haber ligeras variaciones."
Siente - Mindfulness y psicolog칤a positiva,Fundaci칩n facilisimo,Salud y bienestar,4.7,100000,"De los terminos y condiciones de la aplicacion: 6 .- Modificaci칩n de las condiciones de uso FUNDACI칍N FACILISIMO se reserva el derecho de desarrollar o actualizar en cualquier momento las Condiciones de Servicio de la App Siente y su Pol칤tica de Privacidad, por lo que el usuario deber치 leerlas peri칩...Opini칩n completa"
Motivaci칩n Diaria: Una frase motivacional por d칤a,Meta Priori,Estilo de vida,4.4,100000,"Siempre que sales de ella, sales pensando en que siempre hay una forma de poder hacer las cosas... Muy buena app"
"Autoestima, el verdadero amor",Metta Apps,Estilo de vida,4.2,100000,Gran app la verdad esque ase mucho que no sentia nada y solo empesaba a sentir que no importaba y que en cualquier momento moriria sin inportarle a nadie pero aprendi a que amarse y encontrarse co sigo mismo es lo que ase ver que a alguien le importas y te valora y es solo a ti mismo que gran app de...Opini칩n completa
Ley de Atracci칩n,Metta Apps,Estilo de vida,4.5,500000,"La aplicaci칩n es incre칤ble! Tiene todo lectura , audio , afirmaciones ! Super completa ! Lo 칰nico para mejorar es que en las meditaciones se corta el audio justo en la relajaci칩n profunda ! Lo dem치s est치 perfecto ! Espero que lo puedas solucionar por qu칠 es una app Super completa !"
Siente - Mindfulness y psicolog칤a positiva,Fundaci칩n facilisimo,Salud y bienestar,4.7,100000,"Amigos de siente Todo iba bien hasta la actualizaci칩n no me cargan las Meditaciones aveces quiero repetir una del pasado y no deja 침, ya llevo un mes as칤 y estoy pagando, por favor solucionen el tema cuanto antes ya que no quiero dejar de meditar y he tenido que ir a youtube a buscarme una meditaci칩...Opini칩n completa"
Como Ser Feliz,Wilson Castrillon,Estilo de vida,4.6,100000,Sin comentarios: tremenda aplicaci칩n
Libros de Motivaci칩n Personal Gratis游닄Superaci칩n游눩,Grupo StarkApp,Libros y obras de consulta,4.6,5000,"Contiene muchos libros interesantes, pero No funciona si no estas conectado a internet, no es recomendado para navegadores con plan de datos, tambien le hace falta un marcador para fijar la lectura donde la dejaste...Por esas cosas no me sirve.."
Coaching Personal,Metta Apps,Estilo de vida,4.2,100000,Apenas he empezado a usarla y a칰n tengo que entender c칩mo funciona (es poco intuitiva) pero es fabuloso la cantidad de listas preguntas e ideas que hay para poder analizar a fondo todos los problemas y situaciones que necesitemos esclarecer. Muchas gracias.
Curvas de Crecimiento Infantil,"ABQ App Source, LLC",Medicina,4.8,100000,"Muy 칰til, puedes ir haciendo un seguimiento junto con el del pediatra."
Remente - Desarrollo personal,Remente,Salud y bienestar,4.3,500000,Una aplicaci칩n muy buena 
"Frases de Motivaci칩n, 칄xito y Superaci칩n Personal",lyontechapps,Estilo de vida,4.5,5000,Muy buena y muy buen dise침o gr치fico y de la aplicaci칩n
PNL pr치ctico,Metta Apps,Estilo de vida,4.4,100000,"La estoy probando y me encanta, es importante reforzar con lectura pero no todo est치 en una app, si tuviera PDF para descargar ser칤a a칰n mejor"
"Frases de Motivaci칩n, 칄xito y Superaci칩n Personal",lyontechapps,Estilo de vida,4.5,5000,Buena aplicaci칩n pues genera un peque침o inconveniente al descargar o guardar la imagen
El 칄xito (21 pasos),Appsfantastic3001,Estilo de vida,4.7,100000,"Un libro 游닃 de mucho nivel, me guta mucho su contenido, es un libro que te ayudar mucho"
Libros de Motivaci칩n Personal Gratis游닄Superaci칩n游눩,Grupo StarkApp,Libros y obras de consulta,4.6,5000,Muy buena la selecci칩n de libros! Se utiliza la app sin problemas!
Ser feliz Reto 30 d칤as by Metta Apps,Metta Apps,Estilo de vida,4.0,100000,"En la informaci칩n dice solo que es relajaci칩n pero, Esta es una aplicaci칩n que me llevo al hipnotismo. Por lo menos deber칤a decir que le van a hacer a uno."
Autoayuda y Superaci칩n Libro 5,ImagenParaWeb,Estilo de vida,4.6,50000,"Esto es ORO,en lo que se Refiere a LIBROS de Autoayuda,descargala,leela y seguro que te mejora tu vida."
La Mente es Maravillosa - Psicolog칤a y relaciones,Grupo MContigo,Noticias y revistas,4.7,100000,"Es una super aplicaci칩n, me encanta el contenido, me ha ayudado a crecer personalmente y las lecturas son muy digeribles. Todo lo que recomiendan me parece super 칰til. Lo malo es que ya no me llegan notificaciones cuando hay un art칤culo nuevo"
Ley de Atracci칩n,Metta Apps,Estilo de vida,4.5,500000,"Excelente y bien organizada. Ojal치 crezcan y puedan habilitar la opci칩n para bajar los audios quiz치s de manera cifrada como hacen otras apps, podr칤a ser mediante una versi칩n de pago, eso resolver칤a el problema de mucha gente. Ser칤a bueno quiz치s en un futuro puedan sacar una apk de marketing y negoci...Opini칩n completa"
Eleva tu Autoestima y Superaci칩n Personal,Recetas Comida Dietas y m치s Apps gratis ComRecApps,Salud y bienestar,4.6,10000,"Cada libro es un tesoro pero este es m치s a칰n. Me ha ayudado mucho felicidades a la autora ,sigan sacando mas material como este,en serio he disfrutado mucho del contenido"
Mindvalley: Learn and Evolve from the best courses,Mindvalley Inc.,Salud y bienestar,4.6,500000,"Mindvalley es un portal al crecimiento. De la mano de los mejores maestros y maestras a tu ritmo, construyes una mejor versi칩n de ti. El contenido fluye entra y limpia tu alma. S칠 extraordinario, me ense침칩 a perdonar y as칤 poder ir a otro nivel."
"Diarize - diario, motivaci칩n. Desarrollo personal",DV Production,Estilo de vida,4.6,100000,"Muy buena app, bien completa incluso en su versi칩n gratuita. Aconsejar칤a poder vincular con cuenta de Google o Facebook, y adem치s mejorar el dise침o de la misma, ya que si se mejorara la est칠tica e interfaz tendr칤a much칤simo m치s potencial. Pero fuera de eso es ideal"
游 Superaci칩n Personal Gratis y Meditaci칩n 游,CodeSmart,Estilo de vida,4.6,10000,"S칰per recomendable, encontra la paz que buscas y bien guiado, gracias"
Ley de Atracci칩n,Metta Apps,Estilo de vida,4.5,500000,"El contenido es muy bueno y est치 bien organizada, son de lo mejor que he visto, pero se cortan los audios en medio de la meditaci칩n que es lo mismo que no escuchar nada y no responden dudas ni consultas, a punto de desinstalarla, igual que la de ho oponopono. Una lastima!"
Autoayuda y Superaci칩n Libro 2,ImagenParaWeb,Estilo de vida,4.6,10000,Ejercicios mentales
"Autoestima, el verdadero amor",Metta Apps,Estilo de vida,4.2,100000,"La verdad que me ayud칩 mucho, hay que tener paciencia, pero si ten칠s autoestima baja te ayuda aunque sea un poco. Se las recomiendo mucho"
El arte de no amargarse la vida,Livros,Entretenimiento,4.3,10000,"Excelente libro,te dice poco a poco y con buenos ejemplos el camino a seguir para disfrutar la vida plenamente,buena presentaci칩n,buen tama침o de letra, excelente todo"
C칤ngulo: Terapia Guiada,C칤ngulo,Salud y bienestar,4.9,1000000,De momento estoy subiendo mi grado de autoestima y bajando el nivel de ansiedad. Estoy muy contenta con la app.
PNL y Coaching T칠cnicas Gratis,Patoleconteapp,Estilo de vida,3.7,50000,Inyector de basura publicitaria
Motivaci칩n Diaria: Una frase motivacional por d칤a,Meta Priori,Estilo de vida,4.4,100000,"Me gusta mucho por todas las buenas frases que llegan a diario y realmente son motivadoras, gracias a ellas ya se un poco m치s que quiero hacer con mi vida. Les recomiendo mucho est치 aplicacion a todas las personas no solo a las que necesitan motivaci칩n ya que tiene buenas frases de todo tipo."
Coaching Personal PRO,Metta Apps,Estilo de vida,4.9,11000,He encontrado una gran fuente de inspiraci칩n. Hace mas creativa la toma de desiciones. Gran idea felicidades
Coaching Personal,Metta Apps,Estilo de vida,4.2,100000,Se침ores de metta apps. Estoy totalmente agradecido por sus trabajos. Sin darme cuenta baje esta app y la de mindfulness sin saber que las mismas eran de su aporte y de toda la infinidad de apps que tengo noto que estas son las que estan generando un cambio sustancial en mi para bien. Eternamente agr...Opini칩n completa
SkillMentor by Mentorist: SelfHelp Books In Action,Taulab O칖,Educaci칩n,4.5,10000,It's an amazing app. Thank you but please don't convert it into paid version in future. That's the only suggestion.
Eleva tu Autoestima y Superaci칩n Personal,Recetas Comida Dietas y m치s Apps gratis ComRecApps,Salud y bienestar,4.6,10000,Me encanta porque es parctico y su contenido transforma cuado lo pongo en practica
Autoayuda y Superaci칩n Libro 5,ImagenParaWeb,Estilo de vida,4.6,50000,"Son momentos q enaltecen la autoestima de cualquier Ser Humano, y nos ofrece al so침ar y actuar, forjar nuestra historia. Gracias mil por pensar en ello..."
"Diarize - diario, motivaci칩n. Desarrollo personal",DV Production,Estilo de vida,4.6,100000,"Recien la he descargado y estoy aprendiendo a usarla por eso le doy cuatro estrellas, pero hasta el momento parece ser muy buena app, y no me ha traido ningun inconveniente, lo que si estaria muy bien seria que puedan agregarle alarma a los habitos."
El arte de no amargarse la vida,Livros,Entretenimiento,4.3,10000,"Un gran libro.... Me encanto, ayuda bastante en tu vida cotidiana!!!! Recomendado 100%"
Crecimiento Espiritual,Apps B칤blicas Cristianas Interesantes,Libros y obras de consulta,4.6,100000,Tiene excelentes contenidos para la edificaci칩n y orientaci칩n de quienes se nos dificulta un poco entender la Biblia
Mindvalley: Learn and Evolve from the best courses,Mindvalley Inc.,Salud y bienestar,4.6,500000,"De los cursos y videos que he visto en mi vida, puedo decir que esto es lo mejor que me ha pasado. Mi memoria que venia perdiendo ha mejorado muchisimo, con estas tecnicas voy superandome cada dia. Gracias Jim y por supuesto mindvalley"
Quitzilla: Abandona los malos h치bitos,despDev,Salud y bienestar,4.7,1000000,Muy bueno para eliminar esos malos h치bitos que todos hemos deseado borrar. (La interfaz puede ser m치s atractiva y sobre todo m치s did치ctica ya que casi no te enese침an a usar la app y hay que hacerlo por intuici칩n)
Quitzilla: Abandona los malos h치bitos,despDev,Salud y bienestar,4.7,1000000,"Gracias a esta aplicaci칩n dej칠 de morderme las u침as, claro que no es 100% gracias a la aplicaci칩n pero de cierta forma ayuda con sus recordatorios y el simple hecho se tenerla hace que te comprometas un poco m치s a dejar ese h치bito, la recomiendo ampliamente."
"Control y Monitor: Ansiedad, 츼nimo y Autoestima",TwoCats App,Estilo de vida,4.6,1000000,"Una incre칤ble aplicaci칩n, es bastante efectiva, te hace razonar sobre tu 치nimo, y el precio por el premium es bastante bueno. Solo un peque침o defecto, en las actividades del d칤a sobre el estado del 치nimo pongan que se pueda seleccionar m치s de 1 actividad. Porfa"
Coaching Personal,Metta Apps,Estilo de vida,4.2,100000,"Parece buena, la estoy empezando a leer pero seria bueno que las notas(respuestas) estuvieran en cada pregunta.No que esten todas juntas, confunde un poco me parece"
Autoayuda y Superaci칩n Libro 3,ImagenParaWeb,Libros y obras de consulta,4.7,1000,Genial!!!!
Superaci칩n Personal,Gratis y Recomendada !,Estilo de vida,4.3,100000,Seria perfecto tener la aplicaci칩n por audio libro. Ya que seria de gran utilidad cuando se est치 en la oficina o en metro. Gracias
Crecimiento Espiritual,Apps B칤blicas Cristianas Interesantes,Libros y obras de consulta,4.6,100000,"Me gusta la aplicaci칩n con ella se puede aprender mucho a cerca de Dios. La recomiendo a todos aquellos que quieran conocer mejor a Dios. Puntura cinco estrellas si mejoran la funcionalidad es decir que el libro se adapte a la situaci칩n de las pantalla, que se pueda cambiar el fondo y el cambio de f...Opini칩n completa"
Abundancia Reto,Metta Apps,Estilo de vida,4.5,100000,"Muy completa, agradable el proceso de transformaci칩n y abundancia que se recorre d칤a a d칤a y reto a reto, realmente transformador."
Ley de Atracci칩n,Metta Apps,Estilo de vida,4.5,500000,EXELENTE....en mi caso el 칰nico problema es el color de fondo de la aplicaci칩n (ROJO).. afecta mucho p para lo que tenemos problema de vision....un color menos intenso ser칤a fabuloso...!!!!!!
"Autoestima, el verdadero amor",Metta Apps,Estilo de vida,4.2,100000,"춰me encanta! Me ha ayudado mucho en serio se las recomiendo pero, 쯥칩lo tiene 35 tips? Ya los termine pero no me salen los demas"
El arte de no amargarse la vida,Livros,Entretenimiento,4.3,10000,"Excelente libro que ayuda a mejorar muchos aspectos que no nos damos cuenta que est치n mal, ejemplos claros y sencillos, lo recomiendo much칤simo!!"
Superaci칩n Personal en audios,Ledapp71,Comunicaci칩n,4.3,10000,"Esta buena, pero me gustar칤a que donde detienes el audio contin칰e, por que empieza todo el audio, si pudieran poner un bot칩n de retroseder y adelantar estar칤a mejor."
Curvas de Crecimiento Infantil,"ABQ App Source, LLC",Medicina,4.8,100000,"Realmente 칰til, puedo llevar yo misma el control con el peso y talla , claro seguido de su consulta con el pediatra"
SkillMentor by Mentorist: SelfHelp Books In Action,Taulab O칖,Educaci칩n,4.5,10000,Casi todo esta bloqueado porque es pago. Si entras a una seccion despues no puedes salirte. Pocas opciones gratis y te dejan todo lo bloqueado a la vista para q te de bronca. Se ve bueno pero es estresante si no lo puedes comprar.
Eleva tu Autoestima y Superaci칩n Personal,Recetas Comida Dietas y m치s Apps gratis ComRecApps,Salud y bienestar,4.6,10000,"Hermosa app, realmente en mi caso me ayudo mucho. Siempre pense que ten칤a un autoestima alto o persistente, pero al notar que gran parte de mis actitudes no lo son , me motiva a cambiar y pensar mejor algunas acciones que realiz칩, adem치s de motivarme a confiar en mi. Por lo tanto considero que vale ...Opini칩n completa"
Abundancia Reto,Metta Apps,Estilo de vida,4.5,100000,"La app es genial pero los audios se paran todo el rato, es imposible meditar as칤. S칠 que antes no pasaba, ojal치 pod치is solucionarlo"
Autoayuda y Superaci칩n Libro 5,ImagenParaWeb,Estilo de vida,4.6,50000,"No tengo palabras,esta aplicaci칩n siempre la tengo conmigo,porque te inspira una lucha constante por lo que se desea."
La Mente es Maravillosa - Psicolog칤a y relaciones,Grupo MContigo,Noticias y revistas,4.7,100000,"Al registrarte con la cuenta de Google o mediante usuario y contrase침a, la app se congela, teniendo que borrar los datos de la app o desinstalarla y volverla a instalar para que vuelva a funcionar. Es un error que lleva bastante tiempo y actualizaci칩n tras actualizaci칩n no se corrige."
Autoayuda y Superaci칩n Libro 4,ImagenParaWeb,Estilo de vida,4.6,10000,Mui  buenos consejos falta aplicarlos recomiendo  esta aplicacion
Superaci칩n Personal - Librer칤a,Libro Movil,Libros y obras de consulta,3.7,100000,Es mentira que me regalan un libro por semana Cuando busco el supuesto libro regalado me aparese con opci칩n a compra Que mal
Audios de Autoestima游눩Motivaci칩n游땏Superaci칩n仇벒잺,DAVID B MAR칈N,Educaci칩n,4.6,5000,"Es muy reciente el uso de la app, pero a comparaci칩n de otras app las voces no son saturadas al o칤do, gracias"
Superaci칩n Personal,Gratis y Recomendada !,Estilo de vida,4.3,100000,Es alentador q haya personas q sin conocerlas te hagan el bien y otras teni칠ndolas tan cerca te hagan tanto mal
El Poder de la mente,Emprendedora apps,Estilo de vida,4.4,100000,"Cordial saludo. La aplicaci칩n ESTABA entre las mejores de su categor칤a, lamentablemente hice uso de la 칰ltima actualizaci칩n y PERD칈 temas que ven칤a acumulando durante meses, su presentaci칩n gr치fica desmejor칩, incorporaron unos juegos que en nada tienen que ver con la tem치tica. Existe una pol칤tica en...Opini칩n completa"
Libros de Motivaci칩n Personal Gratis游닄Superaci칩n游눩,Grupo StarkApp,Libros y obras de consulta,4.6,5000,Esta app realmente se ense침a a ver las cosas de una manera pensante y pensar en positivo y proponerse con sus metas asta que sean exitos
Educaci칩n Financiera y Superaci칩n Personal,IncreBooks,Libros y obras de consulta,2.9,5000,Cuando le doy a descargar un libro falla la aplicaci칩n y se cierra
PNL y Coaching T칠cnicas Gratis,Patoleconteapp,Estilo de vida,3.7,50000,Por qu칠 necesitan permiso a datos de llamada?
Desarrollo Personal y Financiero para Emprender,S칰per Apps,Educaci칩n,4.5,100000,"Muy buena aplicaci칩n, gran aporte, pero tambi칠n tiene muchas faltas de ortograf칤a, deber칤a cuidarse m치s ese aspecto pues la informaci칩n es de calidad."
游눑 Mentes Millonarias y Superacion Personal,CodeSmart,Estilo de vida,4.8,100000,"Excelente app, en serio la amo, la recomiendo cada vez que tengo oportunidad, me encanta, la tengo desde hace 2 a침os , solo le har칤a una correcci칩n, me encantar칤a que cuando salga de la app y vuelva a entrar, pueda retomar los audio libros desde donde los dej칠, porque siempre tengo que recordar por ...Opini칩n completa"
Educaci칩n Financiera y Superaci칩n Personal,IncreBooks,Libros y obras de consulta,2.9,5000,excelente manejo en cuanto al tema de financiacion.
El Poder de la mente,Emprendedora apps,Estilo de vida,4.4,100000,"Me gusta mucho , muy interesante !!! Todos los dias me envian algo nuevo para leer , me abre la mente. Espero todos los dias para leerlo a la noche, me hace mucho bien.游녧游낖游눩"
游븿 Aumenta tu Sabidur칤a 游븿,Nerv Apps,Estilo de vida,4.4,100000,"Me parece una exelente app porque su contenido es muy bueno, sin embargo, le doy solo cuatro estrellas porque cada vez que entro a la app esta se cierra.. Espero reparen este problema, para dar 5 estrellas"
Ser feliz Reto 30 d칤as by Metta Apps,Metta Apps,Estilo de vida,4.0,100000,"Maravillosa aplicaci칩n!! Agradezco que la hayan hecho y haberla encontrado, me s칰per ayud칩!!"
游 Superaci칩n Personal Gratis y Meditaci칩n 游,CodeSmart,Estilo de vida,4.6,10000,"Excelente aplicaci칩n para la superaci칩n personal y el crecimiento, me nace del coraz칩n felicitar a los autores de la aplicaci칩n, el logrado cambiar cosas incre칤bles en mi vida impulsado por la ense침anza encontrada en esta app. Bendiciones para los autores!"
El 칄xito (21 pasos),Appsfantastic3001,Estilo de vida,4.7,100000,Exelente aplicacion los comentarios son muy facil de entender a sido de gran ayuda en mi persona x eso le doy las 5 estrellas
Siente - Mindfulness y psicolog칤a positiva,Fundaci칩n facilisimo,Salud y bienestar,4.7,100000,Soy sincero
Educaci칩n Financiera y Superaci칩n Personal,IncreBooks,Libros y obras de consulta,2.9,5000,Genial...춰sin comentarios!
"Autoestima, el verdadero amor",Metta Apps,Estilo de vida,4.2,100000,Me parece interesante el proyecto pero no pude reproducir los audios
Remente - Desarrollo personal,Remente,Salud y bienestar,4.3,500000,"Excelente app, primera vez que la utilizo y de verdad siento que est치 generando cambios en m칤. Tiene muchas cosas que puedes hacer, cursos, graves motivacionales, diariamente me env칤an correos bastante buenos la verdad. Lo que m치s me encanta de la aplicaci칩n son los recordatorios que asisten en las ...Opini칩n completa"
Remente - Desarrollo personal,Remente,Salud y bienestar,4.3,500000,"Es una excelente aplicaci칩n para hacer un seguimiento de tus pensamientos diarios, cosa que te ayuda enormemente con tu crecimiento personal, bastante atractiva visualmente y muy intuitiva de utilizar, en mi caso 5 estrellas queda corto ( recuerden que la aplicaci칩n no es M치gica, funciona porque ust...Opini칩n completa"
Superaci칩n Personal - Librer칤a,Libro Movil,Libros y obras de consulta,3.7,100000,"p칠sima aplicacion, se atora el audio, se regresa al incio y no concluye el libro, se apaga solo y al iniciar no empieza donde me quede como lo hacen otras aplicaciones, no volvere a comprar ningun audiolibroas por este medio."
游 Superaci칩n Personal Gratis y Meditaci칩n 游,CodeSmart,Estilo de vida,4.6,10000,Solo falta actualizar d칤a a d칤a la frase del d칤a
