App,Developer,Type,Rates,Downloads+,Last_reviews
TCC Diario de Pensamiento,MoodTools,Salud y bienestar,4.6,100000,"Genial, es sin duda alguna un autotratamiento cognitivo conductual"
Diario - Monitor de 치nimo,Habitics,Estilo de vida,4.6,10000000,"Esta aplicaci칩n me parece tan genial y aunque en su totalidad no sea gratis me parece muy funcional, tristemente estaba esperando a que agregaran el mood de estabilidad, ahora que lo agregaron resulta que es solo premium :( me gustaria que al menos hicieran lo mismo que otras funciones que aunque so...Opini칩n completa"
"Sparkle: Self-Care Checklist, Tracker & Journal",SmartWOD fitness apps,Salud y bienestar,4.6,10000,"La aplicaci칩n me a encantado, funciona a la perfecci칩n y me ha ayudado"
60 Juegos Mentales: Entrenamiento Cerebral Gratis,Peoresnada.com,Preguntas y respuestas,4.0,5000000,Me encanto! Es muy divertida y adem치s es muy buena para la mente... Me gusta la est칠tica y los jueguitos ... 游때
"Mental Doctor,salud mental,Estr칠s,Sue침o profundo",洗떬걺긴,Salud y bienestar,4.5,10000,muy detallada informaci칩n exelente
Diario - Monitor de 치nimo,Habitics,Estilo de vida,4.6,10000000,"Llevo m치s de 2 a침os usando esta app, me gusta mucho, pero justo cuando finalmente ahorr칠 el dinero suficiente para una compra 칰nica, empiezan a cobrar una suscripci칩n mensual DEMASIADO CARA. Por favor pongan ofertas de compra 칰nica, les aseguro que lo pagar칤a si es un precio razonable, pero su suscr...Opini칩n completa"
Diario de animo y preguntas (anti depresi칩n),Reflexio Team,Estilo de vida,4.3,500000,"Excelente App 游녨, me encanta 游녧 , la recomiendo al 100 % , las preguntas , las nubes de palabras de cada mes, y (sobretodo las estad칤sticas de cada mes ) , el diario igual 游뱔 , y tambi칠n los temas , incre칤bles 游뗵"
Medita con Petit BamBou: mindfulness y sue침o,FeelVeryBien sarl,Salud y bienestar,4.7,1000000,Me encant칩 la aplicaci칩n. Y me encanta que sea guiada y a si te ayuda a respirar correctamente y a pensar en cosas que te pueden hacer m치s amena la seci칩n. Y aparte te manda correos con instrucci칩nes para la meditaci칩n. Solo lo que no me gusto mucho fue que si tiene una amplia variedad de sesiones. ...Opini칩n completa
Salud Mental by com.mexiz.app,com.mexiz.app,Salud y bienestar,4.6,1000,Me encanto gracias
"Psic칩logos Online, Diario emocional y Mindfulness",ifeel,Salud y bienestar,4.4,100000,"Muy buena ayuda profesional. Excelente atenci칩n. Descargu칠 esta aplicaci칩n sin tener mucha idea. Necesitaba ayuda y no sab칤a adonde dirigirme. Hay muchas clases de psic칩logos. Aqu칤 me entrevistaron inmediatamente online, rellen칠 un cuestionario y la psic칩loga que me ayuda es estupenda. Por chat escr...Opini칩n completa"
Calm: Meditaci칩n y Sue침o,"Calm.com, Inc.",Salud y bienestar,4.4,10000000,Me encanta!! Felicitaciones al equipo desarrollador. Quisiera informar que tengo 2 dificultades con el tema de los recordatorios: 1. No llegan los recordatorios. las configuraciones de mi Cel est치n bien. Valide con otras apps. 2. Al cambiar la hora del recordatorio de la ma침ana se cambian todas las ...Opini칩n completa
Diario - Monitor de 치nimo,Habitics,Estilo de vida,4.6,10000000,"Una excelente app para llevar un registro de las emociones, ideal para los que trabajan en su inteligencia emocional. Sin embargo, me gustar칤a contar con un widget, ya que as칤 podr칤a llevar el registro y estar pendiente de 칠l"
PSY online terapia psicologia. 햐hat apoyo an칩nimo.,INVOLTA INC,Salud y bienestar,4.4,500000,Es buena app y todo pero la verdad no me agrada que hay usuarios que solo preguntan tonter칤as pero en fin la verdad es buen칤sima app sirve de mucho si tienes alguna duda y quieres saberlo r치pido. Buen trabajo empresa que no conozco. 游땕游땙
Mental Health Tests,"Mind Diagnostics, Inc.",Medicina,4,100000,Buena
PsicoTests,Psique Apps,Medicina,4.6,1000000,"Esta muy buena la app... la verdad es muy importante contar con algunas explicaciones, muchas veces las personas no tienen los recursos para acudir a un profesional o el tipo de trastorno hace que se encierren en la negaci칩n, pero con esta aplicaci칩n podemos f치cilmente reconocer y /o afirmar algunos...Opini칩n completa"
PsicoTests,Psique Apps,Medicina,4.6,1000000,"Es una muy buena aplicaci칩n, aunque para la mayor칤a de los trastornos son los mismos consejos, son nuevos consejos. Me ayud칩 a descifrar mis trastornos o mejor dicho a asegurarlos, lo malo es que son varios y me gustar칤a que me ayudaran mas sus consejos, que fueran mas espec칤ficos como para comenzar...Opini칩n completa"
Ejercicios para el cerebro,ABC Programming,Entretenimiento,4.4,100000,"Todos los juegos est치n bien desarrollados. S칩lo tengo dificultad con Pasatiempo, no puedo cumplir la consigna: arrastro las im치genes para ubicarlas, pero vuelven al lugar original. Evidentemente, debo estar haciendo algo mal, pero no me doy cuenta de qu칠 es."
Moodpath - Depression & Anxiety Test,MindDoc Health,Medicina,4.6,1000000,"Buena app, puedo mantener un registro de mis emociones, actividades y mas sobre mi dia a dia. El unico problema es que esta en Ingles, y aunque mi ingles igual es bastante bueno, igual necesito que este en Espa침ol"
Diario de animo y preguntas (anti depresi칩n),Reflexio Team,Estilo de vida,4.3,500000,"Esta aplicacion es excelente, incluso en su version gratuita, solo con no tener anuncios ya vale la pena, apenas la he probado y ya he comprado la version Premium, no entiendo como se queja la gente de que no sea gratis cuando ronda los 3 y es un pago 칰nico. Encantada de colaborar para que podais s...Opini칩n completa"
Test de Depresi칩n,MoodTools,Medicina,3.8,100000,Es exelente 游뗵 Ame esta app es muy sincera . No ocupo mucho espacio en mi celular y adem치s despu칠s de realizar el test te recomienda sitios para mejorar la deprecion
El Psic칩logo,Frenys,Estilo de vida,4.3,500000,"Esta re buena.., pero arreglen lo de iniciar sesi칩n.... Gracias!"
"Psic칩logos Online, Diario emocional y Mindfulness",ifeel,Salud y bienestar,4.4,100000,"No entiendo porque cuando ya tienen el dinero la app me pone fallos para volver a entrar no quiero pensar mal , pero espero una respuesta del correo que ponen para ello. Y no me deja volver a deskargarlaa. Denuncia asegurada si no logro volver a entrar."
Pura Mente: Meditar es simple,Pura Mente,Salud y bienestar,4.8,50000,Qued칠 sorprendida. Es f치cil. Y el tiempo de la meditaci칩n de 10 min paso rapid칤simo cuando quise acordar ya estaba terminando. Me ayud칩 y lo recomiendo ... La soluci칩n est치 en nosotros. Y la verdad que ense침a q la meditaci칩n es una herramienta para nuestro estilo de vida. No es religioso ni dogmatic...Opini칩n completa
TCC Diario de Pensamiento,MoodTools,Salud y bienestar,4.6,100000,"Util para llevar un auto registro, me saltan notificaciones y asi no lo dejo pasar"
Test de Depresi칩n,MoodTools,Medicina,3.8,100000,"Wow aparte que yo y mi vida sea una basura, la aplicaci칩n tambi칠n me dice que tengo depresion, pero porque no me estoy preocupando ni siento que quisiera arreglarlo"
MoodSpace - Ayuda para el estr칠s y la ansiedad,Boundless Labs,Medicina,4.8,100000,Me gusta mucho la est칠tica de la app y las metodolog칤as que emplea. Me gustar칤a que tal vez le pusieran una opci칩n de poner contrase침a a la hora de entrar a la app ya que puede quedar f치cil para que otra persona entre y lea lo contenido all칤. En general es muy buena.
60 Juegos Mentales: Entrenamiento Cerebral Gratis,Peoresnada.com,Preguntas y respuestas,4.0,5000000,"Gracias a la adaptacion que me pasasteis ya puedo jugar correctamente pero en algunos ejercicios como el mental #4 en dificultad genio se bloquean hasta llegar a determinada puntuacion. Por ejemplo: no puedo puntuar mas de 5, no acepta la respuesta seleccionada. Este error suele ocurrir en algunos e...Opini칩n completa"
Ejercicios para el cerebro,ABC Programming,Entretenimiento,4.4,100000,"Deberian poner un puntaje y una calificaci칩n mejor sin gr치ficos, algo mas claro para personas adultas, como yo. Ser칤a buen칤simo, asi poder usarlo como terapias en grupo. Gracias!!!"
Salud Mental by Charnan.7,Charnan.7,Salud y bienestar,4.6,50000,esta app deber칤a estar en todos los celulares de los chilenos... le falta material did치ctico pero excelente contenido.
Mental Health Tests,"Mind Diagnostics, Inc.",Medicina,4,100000,No se cual es el prop칩sito de esto. Su nombre dice diagnosis (diagn칩stico) pero esto es imposible sin atenci칩n de un profesional. Tambi칠n me parece que deber칤an dar m치s herramientas y menos preguntas.
Pixels - Estados de 츼nimo y Mindfulness,Teo Vogel,Estilo de vida,4.7,500000,"Esta muy bien para tener un diario emocional que te ayuda a ver como respondes al mundo y como te sientes, encima ayuda a recordar cosas ^^"
Medita con Petit BamBou: mindfulness y sue침o,FeelVeryBien sarl,Salud y bienestar,4.7,1000000,"Incre칤ble aplicaci칩n. Tiene un mont칩n de herramientas tanto para la meditaci칩n guiada como para la meditaci칩n libre, sonidos y ayudas para ejercicios de respiraci칩n. Me encanta!! Adem치s sin tener el modo premium tienes acceso a todas estas herramientas, pero con el premium tienes aun muchas m치s posi...Opini칩n completa"
Pura Mente: Meditar es simple,Pura Mente,Salud y bienestar,4.8,50000,"La gu칤a para introducirte a meditar es muy buena. Sin forzar, simple, pr치ctica, m칰sica de fondo, la voz de la instructora realmente te induce a la meditaci칩n. Muchas gracias, me siento m치s tranquila desde esta primera sesi칩n"
Pixels - Estados de 츼nimo y Mindfulness,Teo Vogel,Estilo de vida,4.7,500000,"Me encanta esta app, me ayuda a darle seguimiento a mis emociones y me motiva a tener mejores d칤as. Felicidades por esta app."
Mental Health Tests,"Mind Diagnostics, Inc.",Medicina,4,100000,Tests are very poorly designed
PSY online terapia psicologia. 햐hat apoyo an칩nimo.,INVOLTA INC,Salud y bienestar,4.4,500000,"Me encanto la app, le doy 3 estrellas porque, de la nada me apareci칩 que tengo un error de conexi칩n, siendo que mi net esta bien y no tengo problemas de conectividad en otras apps.... subir칠 las estrellas si me ayudan por favor...... Ahi subi a las 5 estrellas .... gracias por la ayuda"
"Sanvello para el estr칠s, la ansiedad, la depresi칩n",Sanvello Health Inc.,Medicina,4.6,1000000,"No puedo responder las preguntas que la app me hace y varias herramientas no ne deja usarlas, la app no funciona correctamente, cada vez que intento usar una herramienta no me deja por mas que le pique y tengo que salir y volver a entrar."
"InnerHour autoayuda y terapia: ansiedad, depresi칩n",InnerHour,Salud y bienestar,4.4,500000,"Muy buena app, se nota que se ha hecho con mucha dedicaci칩n. Es simple y c치lida, lo que te incentiva a seguir us치ndola. Me encanta especialmente los art칤culos informativos. Me gustar칤a poder ingresar m칤 estado de 치nimo en diferentes partes del d칤a (ma침ana, tarde, noche) ya que suele variar bastante....Opini칩n completa"
PSY online terapia psicologia. 햐hat apoyo an칩nimo.,INVOLTA INC,Salud y bienestar,4.4,500000,Es una l치stima que ya no funcione bien la app porque es una buena idea. Los mensajes tardan mucho en llegar y tampoco se envian. Ya desinstale e instale la app tres veces y no se soluciona.
Meditaci칩n Guiada Gratis,AbacaxiApps,Salud y bienestar,4.3,50000,Muy buena la verdad lo malo es que las meditaciones normales son muy largas por lo demas muy buena 10 de 10
Ejercicios para el cerebro,ABC Programming,Entretenimiento,4.4,100000,"Muy buena app...solo que tengo problemas en realizar el sounds, leo los pasos y al momento de jugarlo no ocurre nada de lo que debo de hacer y solo suena los fragmentos de la m칰sica...quisiera saber porque ocurre esto, lo demas todo perfecto游녨游녨"
Meditaci칩n Guiada Gratis,AbacaxiApps,Salud y bienestar,4.3,50000,"Simple, no se puede utilizar, no puedo acceder a ninguna de las funciones de la aplicaci칩n. No he podido escuchar ninguna de las opciones."
eQuoo: Emotional Fitness Game,PsycApps Ltd. (UK),Salud y bienestar,4.6,50000,"Muy entretenido, y te ayuda a resolver problemas a trav칠s de los distintos tipos de inteligencia que cada uno de nosotros posee"
Pura Mente: Meditar es simple,Pura Mente,Salud y bienestar,4.8,50000,"Me encanta! Antes pensaba que meditar era aburrido y fastidioso, pero gracias a esta App estoy muy enganchada con la meditaci칩n, llevo el 3er d칤a consecutivo y la he usado hasta para dormir! La voz y la m칰sica de fondo son muy relajantes! Me encanta!"
Salud Mental by Charnan.7,Charnan.7,Salud y bienestar,4.6,50000,hermosa app. noble precisa y real. sent칤 que me estaban ayudando. y que los consejos eran para mi. gracias de todo coraz칩n. 游눕
eQuoo: Emotional Fitness Game,PsycApps Ltd. (UK),Salud y bienestar,4.6,50000,"Muy buena app, sobresaliente. Solo la mejoraria que estuviera en espa침ol"
PSY online terapia psicologia. 햐hat apoyo an칩nimo.,INVOLTA INC,Salud y bienestar,4.4,500000,"La aplicacion y la comunidad en lineas generales esta bien , solo que debes estar preparado para ver y recibir cualquier tipo de comentarios tanto positivos como gente ociosa que solo quiere molestar."
TCC Diario de Pensamiento,MoodTools,Salud y bienestar,4.6,100000,"Excelente! Me permite actuar como observador de mis actos, emociones y desde un lugar diferente poder entender y aplicar lo que se en teor칤a y que en los momento de ensimismamiento no puedo ver con claridad. Digamos que es la frutilla del postre ya que me permite llevar a la pr치ctica lo que aprend칤 ...Opini칩n completa"
El Psic칩logo,Frenys,Estilo de vida,4.3,500000,Es La Mejor Aplicaci칩n Psic칩logo Ayuda Muchisimo Es Total Mente Genila Me Encanta Ayuda A Que Reflexionemos
Test de Depresi칩n,MoodTools,Medicina,3.8,100000,ya no funcionan ninguno de los links o numero de telefono
Meditaci칩n Guiada Gratis,AbacaxiApps,Salud y bienestar,4.3,50000,"Excelente app, los sonidos, las voces son maravillosas, te llevan a una relajaci칩n total... Vale la pena descargarla y compartirla. Gracias por realizar una selecci칩n minuciosa de todos los aspectos de la App"
Diario de animo y preguntas (anti depresi칩n),Reflexio Team,Estilo de vida,4.3,500000,"La instal칠 hace apenas 4 d칤as y de veras, me encanta!. Siento como si tomara una gran cantidad de ox칤geno cada que ingreso a la App a diario. Es como un peque침o refugio de tranquilidad, de paz, en el que de un modo muy sencillo puedo ser simplemente yo misma. Estaba buscando sugerencias de aplicacio...Opini칩n completa"
Moodpath - Depression & Anxiety Test,MindDoc Health,Medicina,4.6,1000000,"Me gusta mucho la aplicaci칩n siento que ayuda bastante y tambi칠n me gusta las lecturas que te va dando a medida que vas ingresando como te sientes d칤a con d칤a, es un poco mal que no est칠 en espa침ol pero es una exelente aplicaci칩n que deber치s sirve para llevar un registro de las emociones"
Calm: Meditaci칩n y Sue침o,"Calm.com, Inc.",Salud y bienestar,4.4,10000000,"Pague una suscripci칩n en abril, y ahora no puedo entrar en ning칰n lazo porque me pide que me vuelva a suscribir, entro para suscribirme y me dice que hubo un error,que ya estoy suscripta, pero tengo todo bloqueado, no me di de baja en ning칰n momento, ni tampoco se me devolvi칩 el dinero, por favor qu...Opini칩n completa"
Medita con Petit BamBou: mindfulness y sue침o,FeelVeryBien sarl,Salud y bienestar,4.7,1000000,"Esta aplicaci칩n tiene un mont칩n de herramientas muy 칰tiles, tanto para los novatos como para los que llevan un tiempo meditando: un calendario para llevar un control de las sesiones, temporizadores, avisos, m칰sicas muy relajantes, gu칤as con voces que transmiten serenidad, peque침as historias para pro...Opini칩n completa"
MoodSpace - Ayuda para el estr칠s y la ansiedad,Boundless Labs,Medicina,4.8,100000,"Es mi primera vez probandola y me est치 gustando bastante, le칤 en algunas rese침as y por la misma aplicaci칩n que es gratis s칩lo por un tiempo limitado, me gustar칤a que no fuera as칤 pero eso es imposible creo :(, despu칠s de eso todo bien con la app uwu."
"Sparkle: Self-Care Checklist, Tracker & Journal",SmartWOD fitness apps,Salud y bienestar,4.6,10000,"Me encanta, pero tengo un peque침o problema, es que esta todo en ingl칠s. Alguien sabe como cambiarlo? Gracias"
PD Test - Prueba de Trastornos de la Personalidad,People 딽 Droid,Salud y bienestar,4.1,50000,"Emocionada fui a realizar el test luego de descargar la aplicaci칩n,pero nada se congela y no me permite hacer nada...que desalentador 游 .."
Desordenes mentales,Andrey Borzenko,Educaci칩n,4.5,100000,Me encanta esta app! Algunos de los transtornos que tienes que ver con ser antisocial y eso los tengo yo 游땲. La app es muy informativa 游녨游녨游녨
Calm: Meditaci칩n y Sue침o,"Calm.com, Inc.",Salud y bienestar,4.4,10000000,"Amo esta aplicaci칩n, me encanta. Pagu칠 la suscripci칩n anual y nunca pago por aplicaciones. Y ha valido la pena totalmente!!! Me gustan las tem치ticas y las voces de las meditaciones y am칠 lo m치s nuevo, m칰sica de Kigo, me encanta Kigo 游땍. Muchas gracias 游땕."
Pixels - Estados de 츼nimo y Mindfulness,Teo Vogel,Estilo de vida,4.7,500000,es perfecta pero le falta la opci칩n de poder guardar otros a침os en la nube o algo as칤 :( estuve todo 2019 usando la app y en diciembre perd칤 mi celular. cuando descargue la app en mi tel칠fono nuevo habia perdido todo :((
Desordenes mentales,Andrey Borzenko,Educaci칩n,4.5,100000,"Es buena la informaci칩n aunque si claro falta, lo que me intriga es que neta la info es de Wikipedia???? Wikipedia no es muy fiable, no es muy segura la informaci칩n,. Ser칤a mucho mejor que la fuente de informaci칩n sean de investigaci칩nes, eso ser칤a excelente"
Mental Health Tests,"Mind Diagnostics, Inc.",Medicina,4,100000,"Deber칤a ser para todos ,sin importar la edad"
PD Test - Prueba de Trastornos de la Personalidad,People 딽 Droid,Salud y bienestar,4.1,50000,Buenas tardesy me disculpa pero no puedo estar de acuerdo con el resultado ya que hice dos test y dieron el mismo diagnostico y era difente totalmente las respuestas del test.
"Mejor con Salud - Belleza, dieta y bienestar",Grupo MContigo,Salud y bienestar,4.5,100000,Muy buenos consejos y excelentes art칤culos
"Mejor con Salud - Belleza, dieta y bienestar",Grupo MContigo,Salud y bienestar,4.5,100000,"Excelente APP, es muy ilustrativa, eficiente, integra buena app"
Test de Autoestima,Entretenimiento y curiosidades,Entretenimiento,2.0,1000,"Solo puedes entrar al primer cuestionario, no te deja avanzar a otro"
Aumentar Autoestima,NanchosApps,Estilo de vida,3.5,5000,Me gust칩
Frases de Autoestima,KhoniaDev,Estilo de vida,4.3,10000,"hermosas frases todas divinas,las recomiendo100%gracias por creearlas,sigan asi.."
"D. Psique: H치bitos, Auto-conocimiento",Ag칡ncia Cria,Estilo de vida,3.2,100000,"Es molesto escuchar ""Te doy 15 pesos por la leche , 17 pesos por el pan ... Todo el tiempo "
"D. Psique: H치bitos, Auto-conocimiento",Ag칡ncia Cria,Estilo de vida,3.2,100000,Muchos anuncios. No traducido al 100% y la mayor칤a de cosas son de pago... Esperaba m치s pero alguna cosilla tiene..
"Frases de vida y autoestima, reflexiones hermosas",Appsamimanera,Entretenimiento,3.8,5000,seria que bueno que no se repita las mismas imagenes
Frases de Vida y Autoestima,JekApps Inc.,Personalizaci칩n,4.6,10000,En estos tiempos tan convulsos es muy bueno leer e interpretar estas frases Muy buena esta app
I am  Afirmaciones diarias,Monkey Taps,Estilo de vida,4.8,100000,"Es el APP que buscaba, me parece genial solo le falta una cosa, el sonido de las notificaciones cuando sale un msj, lo ideal para mi seria que suene como un msj y... Pum! Es una afirmaci칩n s칰per genial! Podr칤an considerarlo y ya luego cada uno que lo personalice si desea o no el sonido 游땔"
C칩mo Mejorar tu Autoestima,Carina Guevara,Educaci칩n,4.0,5000,No me gustooo
Psicologia de la Depresi칩n,Nice-Apps,Salud y bienestar,4.7,100000,"Genial, muy educativa y explicada en una terminolog칤a sencilla."
Como mejorar tu autoestima,Free !!,Estilo de vida,4.0,50000,Principal mente tengo problemas con la autoestima 游땞 cualquier cosa que no me agrada me hace sentir deprimida sin 치nimos de nada
Frases de Vida y Autoestima,JekApps Inc.,Personalizaci칩n,4.6,10000,excelente y buena pagina.
Frases de Motivaci칩n para mejorar el Autoestima,Aplicaciones de Amor,Estilo de vida,4.1,10000,Se ve que muy buena pero no se porque no habr칠 los audios y las im치genes me tardan mucho y no salen completa no se que hacer
Test de Autoestima Sexual,Entretenimiento y curiosidades,Salud y bienestar,2.2,1000,Es entretenido :v
I am  Afirmaciones diarias,Monkey Taps,Estilo de vida,4.8,100000,"춰Una de las mejores aplicaciones que he probado! LITERAL, ME ENCANTA. Si pudiera darle m치s estrellas se las dar칤a, sin m치s que decir, los dejo que descarguen la app... nwn"
"Frases de vida y autoestima, reflexiones hermosas",Appsamimanera,Entretenimiento,3.8,5000,No cambian las frases del d칤a
Amandote a Ti Mismo y a otros,ImagenParaWeb,Estilo de vida,4.6,100000,"sigo pensando que nuestras en nuestras vidas el mejor manual de la vida , es la bendita Torah kadosh..ah칤 est치 nuestro andar diario, pero debo ser honesta tambi칠n me gust칩 mucho esta aplicaci칩n..igual me ayuda dede el punto cecular ..!!!!游똂游뎵游녪游녧游꺛游눓游땢游똂 shalom a todos los que lean esta , opini칩n.!!...Opini칩n completa"
Frases de Vida y Autoestima,JekApps Inc.,Personalizaci칩n,4.6,10000,"Excepcional,no tiene desperdicios.muy bueno."
Frases de Vida y Autoestima,JekApps Inc.,Personalizaci칩n,4.6,10000,Es buenoy fasil de bajar
Frases de Autoestima,KhoniaDev,Estilo de vida,4.3,10000,"Megusto mucho,las frases de valoracion ,som muy buenos mensajes."
Frases de Autoestima,KhoniaDev,Estilo de vida,4.3,10000,Me gust칩 mucho... Buen trabajo contin칰en as칤. ..
Elevar la Autoestima,Emprendedora apps,Estilo de vida,4.5,50000,Apenas empiezo con esta app y lla cre칩 que es excelente
Psicolog칤a de la Autoestima,Fasabe-Team,Libros y obras de consulta,4.3,50000,"excelente aplicacion. soy estudiante de psicolog칤a y con esta aplicaci칩n e reforzado mi conocimiento y al mismo tiempo de poderme auto ayudar. la recomiendo ,adem치s no la interrumpe ninguna publicidad ."
Frases de Motivaci칩n para mejorar el Autoestima,Aplicaciones de Amor,Estilo de vida,4.1,10000,"excelente aplicacion., frases bonitas para compartir y empezar el dia con energia"
I am  Afirmaciones diarias,Monkey Taps,Estilo de vida,4.8,100000,Maravillosa app! Las afirmaciones son muy acertadas!仇벒잺
C칩mo Mejorar tu Autoestima,Carina Guevara,Educaci칩n,4.0,5000,Excelente
Test de Autoestima Sexual,Entretenimiento y curiosidades,Salud y bienestar,2.2,1000,Malaso
Videos de Autoestima,freedom loser,Estilo de vida,3.0,500,Me sirve
Mejore su confianza y autoestima (GGSE),GG Apps Platform,Medicina,4.4,50000,NO ESTA EN ESPA칌OLLLLL
Como mejorar tu autoestima,Free !!,Estilo de vida,4.0,50000,춰Es fant치stico! Motivante e inspirador desde el principio. Me ha ayudado a ver el mundo desde una perspectiva positiva.
Psicologia de la Depresi칩n,Nice-Apps,Salud y bienestar,4.7,100000,"No lo he acabado de leer todo pero por lo que he visto tiene demasiada informaci칩n y la verdad es muy 칰til, solo hay que saber manejarla bien."
Amandote a Ti Mismo y a otros,ImagenParaWeb,Estilo de vida,4.6,100000,Me encanta esta app y estoy seguro que no a habido otro parecido. Un excelente app su contenido me llena de amor paz y felicidad....
Aumentar Autoestima,NanchosApps,Estilo de vida,3.5,5000,Es una persona sencibl cari침oso
Psicolog칤a de la Autoestima,Fasabe-Team,Libros y obras de consulta,4.3,50000,Muy bueno y reflexiones sobre todo
Psicolog칤a de la Autoestima,Fasabe-Team,Libros y obras de consulta,4.3,50000,"No me gust칩. Son conceptos de libro, no es ni muy muy ni tan tan las caracter칤sticas que describe de cada cosa. Por eso no lo encuentro 칰til como buena gu칤a para una autoestima sana."
"Frases de vida y autoestima, reflexiones hermosas",Appsamimanera,Entretenimiento,3.8,5000,Me encantaron por que pude compartirlos con mis amigos y tiene muy buenas frases felicidades
Psicologia de la Depresi칩n,Nice-Apps,Salud y bienestar,4.7,100000,Muy clara accesible un gran apoyo para el familiar de un paciente gracias
Test de Autoestima Sexual,Entretenimiento y curiosidades,Salud y bienestar,2.2,1000,Soi gay :v
"D. Psique: H치bitos, Auto-conocimiento",Ag칡ncia Cria,Estilo de vida,3.2,100000,Perfecto
Psicolog칤a de la Autoestima,Fasabe-Team,Libros y obras de consulta,4.3,50000,"hola! realmente me agradan estas publicaciones, pues"
C칩mo Mejorar tu Autoestima,Carina Guevara,Educaci칩n,4.0,5000,Asco
Psicologia de la Depresi칩n,Nice-Apps,Salud y bienestar,4.7,100000,"Me gust칩 bastante, dice cosas muy ciertas que yo puedo asegurar, estoy segura de que muchas personas se sintieron identificadas con esto al igual que yo y no es nada f치cil aceptar que lo est치s viviendo, mucho menos sabiendo que t칰 familia no le toma importancia porque piensa que est치s exagerando. Es...Opini칩n completa"
"D. Psique: H치bitos, Auto-conocimiento",Ag칡ncia Cria,Estilo de vida,3.2,100000,Jajaj Cool! XD
Test de Autoestima,Entretenimiento y curiosidades,Entretenimiento,2.0,1000,"Reitero, de las mejores que he probado."
Frases de Autoestima,KhoniaDev,Estilo de vida,4.3,10000,"Hola.! Les doy las 5 estrellas porque se lo merece. Buena app,frases para todo y te ayuda. La recomiendo mucho y gracias a sus creadores. Un abrazo"
Videos de Autoestima,freedom loser,Estilo de vida,3.0,500,"Te lleva a links de YouTube, solo ocupa espacio y estorba."
Aumentar Autoestima,NanchosApps,Estilo de vida,3.5,5000,bien
Aumentar Autoestima,NanchosApps,Estilo de vida,3.5,5000,Ummm
