App,Developer,Type,Rates,Downloads+,Last_reviews
PsicoTests,Psique Apps,Medicina,4.6,1000000,"Es interesante ,te ayuda en tus dudas ,aprendes cosas que no sab칤as y por eso le doy cinco estrellas realmente buena y recomendable .El 칰nico inconveniente es los anuncios tal vez algo seguidos ,aunque es gratis y hay que comprender eso ,por lo dem치s fenomenal de 10"
Medita con Petit BamBou: mindfulness y sue침o,FeelVeryBien sarl,Salud y bienestar,4.7,1000000,"Muy buena. Sin embargo ha tenido fallos hab칤an quitado las meditaciones de miedo, ansiedad y duelo que estaban gratis hasta las hab칤a descargado y se hab칤an borrado. Tengo una serie seguidas de meditar de 63 pero se borr칩 y se ahora solo muestra que solo he hecho 11. La verdad no s칠 que est치 ocurrie...Opini칩n completa"
Ser feliz Reto 30 d칤as by Metta Apps,Metta Apps,Estilo de vida,4.0,100000,"Es genial!, me super ayud칩, solo que al fin y al cabo sigo sintiendo algo por ella...., pero a칰n as칤 muy buena la app, la recomendar칤a"
"Psic칩logos Online, Diario emocional y Mindfulness",ifeel,Salud y bienestar,4.4,100000,"Absolutamente recomendable y maravilloso servicio. S칩lo las personas que sufrimos de alg칰n tipo de trastorno mental, sabemos lo que es sentirse s칩lo e incomprendido. Esta aplicaci칩n arroja un poco de luz donde todo parec칤a oscuro. Es un chaleco salvavidas. Gracias, gracias y MIL VECES GRACIAS."
Calm: Meditaci칩n y Sue침o,"Calm.com, Inc.",Salud y bienestar,4.4,10000000,"Me gusta, la uso a diario para meditar o para dormirme. Me encantar칤a que la m칰sica tuviera reproducci칩n continua con varios autores del mismo tema (a veces ya estoy totalmente concentrada y se acaba el tiempo de reproducci칩n). Me parece que falta m치s variedad en temas de meditaci칩n como la sanaci칩n...Opini칩n completa"
"Isotonos - Relajaci칩n, Meditaci칩n, Salud",ronin2ninja,Salud y bienestar,4.5,100000,"Hola. Me gusta la app. Se que la intenci칩n es positiva pero muchos tonos se detienen y dejan de escucharse. La opci칩n de ""almacenar"" no funciona. No se direcciona a ninguna carpeta de sonidos ni en la memoria principal ni en la sd. Sin embargo gracias. Estar칠 pendiente de su actualizaci칩n para recom...Opini칩n completa"
Calm: Meditaci칩n y Sue침o,"Calm.com, Inc.",Salud y bienestar,4.4,10000000,"Me gusta mucho la app, 칰ltimamente estoy durmiendo escuchando lo poco disponible, me parece una lastima que se tenga que pagar por pr치cticamente todo, el 95% de lo ""disponible"". S칩lo por eso,le doy 3 estrellas porque te obliga a pagar b치sicamente. Y ac치 en Argentina est치 como dif칤cil pagar en d칩lare...Opini칩n completa"
Fabulous: 춰Mot칤vame!,TheFabulous,Salud y bienestar,4.5,5000000,"La mejor experiencia!! Me encanta que los h치bitos son de a poco ,logras uno y te preparan otro,no te presionan te dan tus tiempos,las frases son muy motivadoras,el que lo comparen a un viaje est치 buen칤simo,las informaci칩nes muy buenas y cient칤ficamente comprobadas ,nunca he visto una aplicaci칩n que ...Opini칩n completa"
Serenmind: tu app de ayuda psicol칩gica,Serenmind,Salud y bienestar,4.3,5000,"Me gustaba mucho esta aplicaci칩n, porque me estaba ayudando a entenderme, pero llevaba una temporada sin entrar y hoy cada vez que quer칤a escuchar un audio, al minuto se sal칤a de la app, as칤 que no s칠 qu칠 pasa y eso que la tengo actualizada"
Salud Savia,SALUD SAVIA,Salud y bienestar,4.0,100000,"Hoy llame al recomendarme esta aplicaci칩n y me he quedado muy satisfecha con la atenci칩n super r치pido y una buena valoraci칩n, y sin ning칰n tipo de coste, muchas gracias Savia por esta gran aplicaci칩n que en estas situaci칩n que estamos viviendo es perfecto .Gracias"
PNL pr치ctico,Metta Apps,Estilo de vida,4.4,100000,Me gusta muy concisa pero completa
Meditaci칩n Guiada Gratis,AbacaxiApps,Salud y bienestar,4.3,50000,Estan muy interesantes las meditaciones guiadas y lo unico malo que percib칤 es que el sonido esta mas alto que la voz del locutor esto hace que sea dificil concentrarse en lo que dice. Gracias de todas maneras
"Control y Monitor: Ansiedad, 츼nimo y Autoestima",TwoCats App,Estilo de vida,4.6,1000000,"Esta es de las mejores cosas que me pas칩, es una aplicaci칩n muy f치cil de usar, de f치cil acceso, con funciones incre칤bles, en lo personal me gusta mucho y me es muy 칰til, esta muy elaborado... Me encanta!"
Pixels - Estados de 츼nimo y Mindfulness,Teo Vogel,Estilo de vida,4.7,500000,"me gusta mucho la app, pero estar칤a bueno que se pueda poner fotos en cada dia, y tambi칠n que se pueda poner alguna cuenta as칤 no perdes los datos si se cambia de dispositivo."
Psicolog칤a Positiva F치cil,3Temes Publishers,Salud y bienestar,4.1,50000,"letras muy peque침as, que se hace imposible leer...y al entrar a los Test se me tilda el celular"
PSY online terapia psicologia. 햐hat apoyo an칩nimo.,INVOLTA INC,Salud y bienestar,4.4,500000,No me permite abrir la app y me gustar칤a seguir utilizandola ya que conoc칤 gente que me ayud칩 mucho solo dice que conectar con el servidor y me manda directo a enviar un correo ala p치gina solicitando una soluci칩n :(
#SelfCare,"Tru Luv Media, Inc.",Juegos de rol,4.4,500000,"Me encanta. A veces se cierra solo, pero pasa muy pocas veces. Lo 칰nico que cambiar칤a es que es demasiado corto y no hay casi nada para hacer, aunque esas peque침as actividades me relajan y me gustan mucho; yo creo que ser칤a perfecto si cada d칤a a침adieran algo m치s o que a침adieran cosas a las actividades que ya se pueden hacer. La verdad, me gust칩 mucho. La recomiendo si est치s estresado o algo por el estilo, aunque tambi칠n porque s칤."
#SelfCare,"Tru Luv Media, Inc.",Juegos de rol,4.4,500000,Es muy buena pero no se por qu칠 se me borran los datos. Me ha pasado ya unas cuantas veces y es muy molesto empezar de cero una y otra vez. Alguna idea de porqu칠 sucede 칠sto?? Propongo la posibilidad de abrir el juego con gmail para no perder los datos cada vez que le da la gana al juego de reiniciarse.
#SelfCare,"Tru Luv Media, Inc.",Juegos de rol,4.4,500000,"Me hubiera gustado probarla m치s, m치s sin embargo no me encanta que est칠 todo en ingl칠s, me llamo mucho la atenci칩n y me entristece no poder entender de que se trata ya que no se ingl칠s, igual pude notar que es una buena app, pero si hay que tomar muy encuenta que si no sabes ingl칠s te costar치 entender que hacer.... Ya que no es muy clara."
#SelfCare,"Tru Luv Media, Inc.",Juegos de rol,4.4,500000,El juego est치 bien solo dos cosas no me gustaron 1:que est칠 en ingl칠s y no se pueda traducir a otros idiomas 2:que te aburres f치cilmente :/ ya que tiene muy pocas cosas con las cuales puedas interactuar
7 Cups - ansiedad y estr칠s,7 Cups of Tea,Salud y bienestar,4.1,1000000,"Es muy buena app, te ayuda mucho si estas buscando ayuda, hay personas que realmente te ayudan mucho"
7 Cups - ansiedad y estr칠s,7 Cups of Tea,Salud y bienestar,4.1,1000000,"La am칠, me parece una idea genial que exista est치 app y que a칰n haya personas con ganas de ayudar a otros, somos todos uno, debemos ayudarnos"
7 Cups - ansiedad y estr칠s,7 Cups of Tea,Salud y bienestar,4.1,1000000,"He tenido una buena experiencia, pero se deben manejar bien los filtros de b칰squeda para evitar personas indeseadas. Un agrado hablar con un par de oyentes uno de US y otro de India 仇"
7 Cups - ansiedad y estr칠s,7 Cups of Tea,Salud y bienestar,4.1,1000000,"me gusta mucho, hay gente muy sensible y ayudan mucho gracias por esta aplicacion lo unico es que a veces cuando uso el bot,se borran algunos mensajes y se mezclan todos, y tengo que cerrar y volver a abrir la aplicacion"
Ada  tu gu칤a de salud,Ada Health,Medicina,4.7,5000000,"Excelente, muy acertada, pero deber칤a incluir la posibilidad de modificar los s칤ntomas o condiciones, por ejemplo yo fume durante muchos a침os y ahora ya no lo hago, pero pienso que deber칤a haber la posibilidad de eleg칤r la condici칩n de ex fumador, quise cambiar esa caracter칤stica pues considero que es importante y ya no pude hacerlo o no supe como hacerlo. Saludos."
Ada  tu gu칤a de salud,Ada Health,Medicina,4.7,5000000,"Son muy acertados en sus diagn칩sticos, como muestra para tener la certeza de que lo estan haciendo bien primero consulto al medico y luego utilizo la app de Ada. Lo hice la primera y segunda vez, de ah칤 en adelante no a sido necesario. Felicitaciones por su gran ayuda."
Ada  tu gu칤a de salud,Ada Health,Medicina,4.7,5000000,"Detecto un s칤ntoma que le diagnosticaron a mi esposa, es una aplicaci칩n incre칤ble el cual puede ayudar a detectar alg칰n tipo de enfermedad a tiempo, a칰n as칤 no debemos olvidar que es solo una aplicaci칩n, si los s칤ntomas contin칰a debemos acudir al nuestro m칠dico."
Ada  tu gu칤a de salud,Ada Health,Medicina,4.7,5000000,"Realmente ayuda mucho cuando uno no sabe que le pasa, ya sea a uno mismo o a un familiar cercano, est치 en espa침ol y tiene una buena descripci칩n de cada s칤ntoma que se seleccione para asegurar que es lo que uno siente. Parece brindar buenos resultados y te avisa que son RECOMENDACIONES y que deber칤as consultar a tu m칠dico para una evaluaci칩n m치s segura De todas formas es un 5/5"
All Mental Disorders and Treatment,ruthie apps,Medicina,4.4,50000,WONDER
All Mental Disorders and Treatment,ruthie apps,Medicina,4.4,50000,So good
All Mental Disorders and Treatment,ruthie apps,Medicina,4.4,50000,Me resulto bien interesante y asi de paso se lo muestro a mi hija pero me hubiera gusta que estuviera tanbien en espanol .porque yo asisto a un grupo de terapia y muchas personas ayi no saven ingles y les iva a pedir que los bajaran en sus tel칠fonos piensen en esta posibilidad en un futuro.
All Mental Disorders and Treatment,ruthie apps,Medicina,4.4,50000,Excellent!
Always Positive - Daily Motivational Quotes,VizNext,Estilo de vida,4.6,100000,"Pagu칠 para no ver publicidad de ning칰n tipo y sigue apareciendo ""Recommended app"", es muy molesto."
Always Positive - Daily Motivational Quotes,VizNext,Estilo de vida,4.6,100000,Good
Always Positive - Daily Motivational Quotes,VizNext,Estilo de vida,4.6,100000,Nice
Always Positive - Daily Motivational Quotes,VizNext,Estilo de vida,4.6,100000,Happy thought
Amazing Psychology Facts,GV Apps,Libros y obras de consulta,4.3,1000000,"La verdad, si es muy buena la app, pero la verdad es que me gustar칤a que estuviera en espa침ol, es que siempre se me traba al traducir y molesta mucho, as칤 que si pueden tener la traducci칩n en espa침ol ser칤a genial."
Amazing Psychology Facts,GV Apps,Libros y obras de consulta,4.3,1000000,Datos interesantes y curiosos. Me agrada la app
Amazing Psychology Facts,GV Apps,Libros y obras de consulta,4.3,1000000,Es buena. Lastima que no este en espa침ol
Amazing Psychology Facts,GV Apps,Libros y obras de consulta,4.3,1000000,Es breve y concisa
Arr치ncalo: Pelos y emociones,Feeling Game Company,Preguntas y respuestas,4.7,100000,"El juego es genial, lo recomiendo, si que los gr치ficos son simples y sencillos, pero a pesar de eso la idea del juego me parece original que es lo que importa. Aparte de que no hay anuncios, y eso la verdad est치 muy bien. Para las personas que ponen una estrella porque no pueden arrancar el primer pelo quiz치s es porque lo hac칠is solo con un dedo (a mi me pas칩, pero luego me fij칠 bien y no hay que hacerlo as칤), ten칠is que pellizcarlos con dos dedos y tirais despacio, no es tan dif칤cil."
Arr치ncalo: Pelos y emociones,Feeling Game Company,Preguntas y respuestas,4.7,100000,"Creo que es un juego muy entretenido. No tiene anuncios y es gratis los gr치ficos son buenos 游녧 La app es sencilla La recomiendo mucho No entiendo porque algunos se quejan si no tiene anuncios (y por otros juegos que si lo tienen se quejan, decidanse 九) Quiz치 para algunos es aburrido pero este juego es como Anti-estres. Felicidades a los creadores游녧游뗹仇 M치s juegos como este."
Arr치ncalo: Pelos y emociones,Feeling Game Company,Preguntas y respuestas,4.7,100000,"Lo ame, muy bueno que no le hayan puesto anuncios la verdad me suelen estresar cuando juego y me salen. Vengo de la parte donde dice pasi칩n ame esa parte y como no puedo darles platas vengo a dejar mi rese침a, es muy buena la aplicaci칩n, un momento para sentir varias emociones es divertido, me la pase muy bien sigan asi, los graficos estan muy bien al igual que la explicacion, 10/10 usenlo!!"
Arr치ncalo: Pelos y emociones,Feeling Game Company,Preguntas y respuestas,4.7,100000,"Esto es una obra de arte hermosa, no dura mucho pero es un viaje que te hace sentir tantas cosas!!! Eso s칤 hay que estar dispuestos a sentirlas... me hizo llorar, re칤r, enojar y sentir tantas cosas. Gracias (recomendaci칩n juegenlo en un lugar donde no reciban interrupciones y en un lugar privado)"
Avocation - H치bitos diarios,David J칬ch,Estilo de vida,4.4,100000,"Es facil de usar y esta bien. Estar칤a bien que un h치bito pudiera hacerse a la mitad o un poco, porque tienes que hacerlo todo completo cuando lo tocas."
Avocation - H치bitos diarios,David J칬ch,Estilo de vida,4.4,100000,"La verdad muy f치cil de usar, y est칠tica, yo s칠 que tiene que tener su paga pero la verdad no tengo m칠todo de pago ya que soy menor, y me gustar칤a tener m치s habitos"
Avocation - H치bitos diarios,David J칬ch,Estilo de vida,4.4,100000,"游꺞}Realmente est치 buena, pero solo si la usas paga ya que tienes cierta cantidad de recordatorios y si por ejemplo ya terminaste cierta tarea hay algunas que no te deja que toques que ya est치 lista, es como que se bloquea, estar칤a bueno que todo esto este sin ser pago ya que es algo muy necesario para la app y con esto pago van a tener m치s desinstalaciones ya que no todos pagan, tambi칠n estar칤a bueno que agregaran alarma para que avise que tienes una tarea. Gracias por leer"
Avocation - H치bitos diarios,David J칬ch,Estilo de vida,4.4,100000,"Me encanta esta aplicaci칩n. La compart칤 con mis estudiantes para un proyecto de mejora de h치bitos y fue excelente el resultado, adem치s despu칠s de terminar el proyecto muchos a칰n la conservan para continuar mejorando. Los felicito grandemente"
Bearable - Symptoms & Mood tracker (BETA),Bearable Ltd,Salud y bienestar,4.8,10000,I can't put in words how much I love this app The only suggestion i can make is to make customizable the hours in the time lapses (pre-am-mid-pm)
Bearable - Symptoms & Mood tracker (BETA),Bearable Ltd,Salud y bienestar,4.8,10000,"This Is the best app to track my mood I used so far, Its reallt Easy to use and adds a lot of info from the day in a single page"
BetterHelp: Online Counseling & Therapy,BetterHelp - Therapy Made Easy,Salud y bienestar,4.5,500000,Buen servicio y ayuda en tiempos de alto estr칠s.
BetterHelp: Online Counseling & Therapy,BetterHelp - Therapy Made Easy,Salud y bienestar,4.5,500000,Falso! Hay que pagar casi $50 por semana.
BetterHelp: Online Counseling & Therapy,BetterHelp - Therapy Made Easy,Salud y bienestar,4.5,500000,Muy buena. Sugiero un precio m치s asequible.
BetterHelp: Online Counseling & Therapy,BetterHelp - Therapy Made Easy,Salud y bienestar,4.5,500000,Es una estafa.
Bipolar Test,MoodTools,Salud y bienestar,3.1,10000,No esta en espa침ol :(
Bipolar Test,MoodTools,Salud y bienestar,3.1,10000,No esta en espa침ol y en ingles es muy dificil responder el test no me gusta :'(
Bipolar Test,MoodTools,Salud y bienestar,3.1,10000,Caca
Booster Buddy,Island Health,Salud y bienestar,4.3,100000,"Preciosa, aunque echo en falta mi idioma"
Booster Buddy,Island Health,Salud y bienestar,4.3,100000,Es una aplicaci칩n hecha por profesionales que te ayuda a enfocar tu energ칤a en cosas positivas. Me gust칩 mucho :)
Booster Buddy,Island Health,Salud y bienestar,4.3,100000,Tiene un muy lindo dise침o y est치 hecha muy bien游땘游땢
Booster Buddy,Island Health,Salud y bienestar,4.3,100000,춰Es muy buena! Sin embargo me gustar칤a que tuviera la opci칩n de hacer una cuenta o algo parecido para almacenar tus datos y no perder tu progreso.
Calm Harm - manages self harm,stem4,Salud y bienestar,4.3,100000,"es 칰til, me ayud칩 en varias ocasiones, pero le pongo 3 estrellas porque solo viene en ingl칠s, y yo lo entiendo, pero la gente que no habla el idioma y le podria ser 칰til no puede usarla"
Calm Harm - manages self harm,stem4,Salud y bienestar,4.3,100000,"Si me ayudo algunas veces, pero comenzo a trabarse y cada vez que la instalo no me deja avanzar. Tiene muy buenos remedios, pero deberias revisarla."
Calm Harm - manages self harm,stem4,Salud y bienestar,4.3,100000,Le faltan m치s opciones de idioma pero es muy 칰til
Calm Harm - manages self harm,stem4,Salud y bienestar,4.3,100000,"muy buena, pero seria mejor en espa침ol"
Chiku - Your personal diary and mood tracker,Chiku.app,Salud y bienestar,4.6,5000,"La aplicaci칩n es excelente, todos los d칤as te motiva con una cita nueva y con retos sencillos pero que realmente hacen la diferencia en tu vida 游땕. La interfaz es bell칤sima y la aplicaci칩n en s칤 es preciosa y me est치 ayudando mucho.游땏 Muchas gracias por arreglar el peque침o fallo, ahora funciona perfectamente 救넉셿救넉셿救"
Chiku - Your personal diary and mood tracker,Chiku.app,Salud y bienestar,4.6,5000,"Me gusta la aplicacio, le doy 3 estrellas porque no esta totalmente en espa침ol los retos y las preguntas est치n en ingl칠s y no siempre tengo el tiempo de hacer la traducci칩n, y por eso el d칤a de hoy no las hice, cuando arreglen eso les doy las 5 estrellas"
Chiku - Your personal diary and mood tracker,Chiku.app,Salud y bienestar,4.6,5000,Muy bonita app me gusto mucho el dise침o y gracias por corregir el problema de las im치genes en los pdf. 游땕
Chiku - Your personal diary and mood tracker,Chiku.app,Salud y bienestar,4.6,5000,Es malo no se puede entrar mejorenlo porfas se ve muy bueno <:c
CogniFit Ejercicio Cerebral,CogniFit Inc,Salud y bienestar,4.4,100000,"Parece muy completa en los informes que proporciona. Creo que no deber칤a tomarse a la ligera, parece m치s una herramienta de seguimiento y tratamiento para uso profesional que para el p칰blico en general, donde la mayor칤a no tenemos ni repajolera idea de la jerga neuropsicol칩gica que emplean. Por otro lado me parece excesivamente caro el precio por una sola evaluaci칩n y de un solo uso que se genera autom치ticamente seg칰n resultados y que no es fiable al 100%. puede mejorar."
CogniFit Ejercicio Cerebral,CogniFit Inc,Salud y bienestar,4.4,100000,"Muy bueno, a칰n estoy usando la versi칩n gratis, no me gustan mucho las suscripciones, preferir칤a un pago 칰nico."
CogniFit Ejercicio Cerebral,CogniFit Inc,Salud y bienestar,4.4,100000,"Es una buena herramienta para ejercitar el cerebro. Tiene un excelente soporte, responden r치pidamente cuando se presentan problemas."
CogniFit Ejercicio Cerebral,CogniFit Inc,Salud y bienestar,4.4,100000,"Me parece una buena app, pero en mi celular Samsung galaxy j2 prime, no me funciona bien, se sale en medio de un ejercicio y tengo que comenzarlo denuevo"
Conceptos en Psicolog칤a,AppsStar,Libros y obras de consulta,4.5,10000,Me la instal칠 y no habr칠 la app... estuve intentando todo un d칤a y nada
Conceptos en Psicolog칤a,AppsStar,Libros y obras de consulta,4.5,10000,Es demasiado buena aunque a mi no me sale depresi칩n
Conceptos en Psicolog칤a,AppsStar,Libros y obras de consulta,4.5,10000,Excelente
Conceptos en Psicolog칤a,AppsStar,Libros y obras de consulta,4.5,10000,Muy bueno
"Deepstash - Self Improvement, Motivation & Care",Deepstash,Educaci칩n,4.8,1000000,"Geniales gu칤as, tips, consejos y frases motivadoras y muy 칰tiles. Agradecer칤a que tenga una actualizaci칩n en ingl칠s. Una idea que me gustar칤a darles, agreguen una secci칩n para seguimiento de una idea/h치bito que uno quiere implementar d칤a a d칤a o x tiempo. Tengo guardado varias ideas, pero se me acumulan y nos las implement칩. Me gusta que agreguen esa opci칩n."
"Deepstash - Self Improvement, Motivation & Care",Deepstash,Educaci칩n,4.8,1000000,"Demasiado 칰til. Aunque se agradecer칤a que hubiese una aplicaci칩n general tambi칠n para iPad OS para que se aprovechase la pantalla en ese dispositivo, al igual que una versi칩n en espa침ol, aunque eso no es realidad un problema por el momento. Desde su salida en beta he estado observando la aplicaci칩n, y he de decir que cada vez mejora m치s."
"Deepstash - Self Improvement, Motivation & Care",Deepstash,Educaci칩n,4.8,1000000,"Llevo pocos d칤as usando la app pero me ha gustado mucho. Me gusta que tiene los conceptos bien aterrizados y resumidos y en pocos minutos tienes aprendizajes, consejos y tips que te ayudan en el d칤a a d칤a."
"Deepstash - Self Improvement, Motivation & Care",Deepstash,Educaci칩n,4.8,1000000,"Buena aplicaci칩n, pero generalmente los art칤culos de repiten o son pocos"
Depression Cure Music,Sajan Jossan,Salud y bienestar,4.6,50000,Muy buena aplicaci칩n incomparable
Depression Cure Music,Sajan Jossan,Salud y bienestar,4.6,50000,"Nice app , but the timer is alittle confusing and would be great if you could add nature sounds"
Depression Cure Music,Sajan Jossan,Salud y bienestar,4.6,50000,"Me gust칩, variado"
Depression Cure Music,Sajan Jossan,Salud y bienestar,4.6,50000,Ayuda mucho :)
Depression: The Game,LUXO,Puzles,3.4,10000,Pocos niveles pero lo describe a la perfecci칩n
Depression: The Game,LUXO,Puzles,3.4,10000,Muy realista y fuerte a la vez. Felicito a los creadores 鮫봺잺
Depression: The Game,LUXO,Puzles,3.4,10000,Expresa perfectamente la depresi칩n
Depression: The Game,LUXO,Puzles,3.4,10000,"Excelente, quiero mas niveles :("
Diario - Monitor de 치nimo,Habitics,Estilo de vida,4.6,10000000,"Llevo m치s de 2 a침os usando esta app, me gusta mucho, pero justo cuando finalmente ahorr칠 el dinero suficiente para una compra 칰nica, empiezan a cobrar una suscripci칩n mensual DEMASIADO CARA. Por favor pongan ofertas de compra 칰nica, les aseguro que lo pagar칤a si es un precio razonable, pero su suscripci칩n es demasiado cara y lamentablemente no los puedo apoyar de otro modo."
Diario - Monitor de 치nimo,Habitics,Estilo de vida,4.6,10000000,"Esta aplicaci칩n me parece tan genial y aunque en su totalidad no sea gratis me parece muy funcional, tristemente estaba esperando a que agregaran el mood de estabilidad, ahora que lo agregaron resulta que es solo premium :( me gustaria que al menos hicieran lo mismo que otras funciones que aunque son limitadas se pueden usar."
Diario - Monitor de 치nimo,Habitics,Estilo de vida,4.6,10000000,"Esta muy bien! Lo que me preocupa un poco,es si de repente me da ganas de ponet cosas personales.... Pero me siento segura por que tengo una clabe para que nadie me pueda ver nada. Pero no os aconsejaria poner algo un poco personal,solo cosas que te an pasado a lo largo del dia o cosas que quieras conentar con (Diario) que no creas aue si lo be alguien te cotestara de tal manera"
Diario - Monitor de 치nimo,Habitics,Estilo de vida,4.6,10000000,"Estar칤a bien que agregaran la opci칩n de gregar notas como un diario escrito, cuando queramos anotar algo fuera de lo normal o como algo cotidiano y m치s 칠nfasis en la construcci칩n de h치bitos, aprovechando la cuarentena, agregar algo que indique que seguimos en cuarentena."
"Easy Psychiatry : Online Clinic, Affirmations",DR OLUWASEGUN WAHAAB,Salud y bienestar,4.8,5000,"Es una app bastante interesante en el 치rea de la psicolog칤a, con contenido de gran ayuda."
"Easy Psychiatry : Online Clinic, Affirmations",DR OLUWASEGUN WAHAAB,Salud y bienestar,4.8,5000,Interesante aplicaci칩n. Para los tiempos que estamos viviendo viene fenomenal.
"Easy Psychiatry : Online Clinic, Affirmations",DR OLUWASEGUN WAHAAB,Salud y bienestar,4.8,5000,Interesante herramienta para chequeo psiquiatrico y seguimiento del estado an칤mico y otros problemillas.
"Easy Psychiatry : Online Clinic, Affirmations",DR OLUWASEGUN WAHAAB,Salud y bienestar,4.8,5000,"Enhorabuena por la aplicaci칩n, ayuda mucho a las personas y esta muy bien dise침ada y planteada."
eMoods Bipolar Mood Tracker,eMoods,Salud y bienestar,4.6,100000,"Demasiado buena , lo mas genial es que puedes enviar el reporte final a tus especialistas para que esten al tanto de los 치nimos y desibeles ."
eMoods Bipolar Mood Tracker,eMoods,Salud y bienestar,4.6,100000,"Muy 칰til til. Eso s칤, emplearla en varios dispositivos resulta farragoso. Que se brindara la posibilidad de que los datos se actualizaran autom치ticamente en varios terminales de forma autom치tica ser칤a fant치stico ."
eMoods Bipolar Mood Tracker,eMoods,Salud y bienestar,4.6,100000,Excelente app. Incre칤blemente 칰til
eMoods Bipolar Mood Tracker,eMoods,Salud y bienestar,4.6,100000,"Es un comienzo,los registros ne ayudar치n a prevenir una subida exponencial de 치nimo para no llegar a una p칠rdida de control de mis capacidades.A trav칠s de mi autoobservaci칩n de mis sensaciones corporales,mis creencias,mi tono de voz,exceso de verbalizaci칩n,buscando las causas.Comparando lo escrito con parte de lo conscientemente sentido, voy mejorando.Gracias. Voy dejando comentarios,no me importar칤a someterme a un estudio si ayudo a m치s gente a superar la hiperactividad del sistema nervioso."
Headspace: Meditaci칩n y Sue침o,"Headspace for Meditation, Mindfulness and Sleep",Salud y bienestar,3.5,10000000,"A m칤 que ya he realizado un curso MBSR (Mindfullness) me esta sirviendo mucho. Llevo ya 1 mes con la versi칩n premium y solo tengo una pega: la parte de relajaci칩n de cada audio de cualquier curso, se repite, es pr치cticamente la misma, de tal forma que solo hay contenido formativo durante los dos primeros minutos y el 칰ltimo, entre medias estar칤a la relajaci칩n repetitiva. Lo profesional ser칤a repartir el contenido formativo de cada audio durante todo el ejercicio. 춰Y falta contenido en espa침ol!"
