App,Developer,Type,Rates,Downloads+,Last_reviews
Asistente de Dieta - Motivaci칩n para perder peso,Mobile Heroes,Salud y bienestar,4.5,10000000,"Recuerdo que antes pod칤as poner varios desaf칤os en la versi칩n gratuita, es una l치stima que ahora s칩lo se pueda poner una... Por lo dem치s, todo bien. Me gusta mucho la app"
Motivation - Frases diarias,Monkey Taps,Salud y bienestar,4.7,500000,La app est치 buena la recomiendo pero casi todo se tiene que comprar y cuando ves un anuncio para desbloquear un tipo de frase se supone que no te deben de mostrar otro anuncio COMO DIGO CASI TODO SE COMPRA SOLO HAY TRES COSAS TE DAN Y ESO TIENES QUE VER ANUNCIO CADA VEZ QUE QUIERES PONER la app es b...Opini칩n completa
Historias para el Alma - Cuentos de la vida,AbacaxiApps,Libros y obras de consulta,4.7,10000,no e le칤do todas sus historias pero son buenas y cortas aunque me gustan m치s las historias largas la app me gusta la recomiendo.
Frases Bonitas para Motivar a las personas,PiojoApps,Estilo de vida,4.5,5000,Es muy buena me gusta .Tiene Frases y im치genes buenas.
Frases de Motivaci칩n y Refleccion Diaria Gratis,Tec Star Studio,Estilo de vida,4.4,100000,Me encanta.. Las frases son muy acertadas
Historias para el Alma - Cuentos de la vida,AbacaxiApps,Libros y obras de consulta,4.7,10000,Esta muy bien para leer libros pero yo queria y he puesto en el buscador crear libros no leer libros. Tambien cada vez que entras en un libro tienes que mirar un anuncio游땛游땞游땞
Frases Motivadoras - Pensamientos Positivos,MooniKapps,Entretenimiento,4.7,10000,"Excelente aplicaci칩n, para motivar aquellos seres queridos ,amiatades"
Historias para el Alma - Cuentos de la vida,AbacaxiApps,Libros y obras de consulta,4.7,10000,Me encant칩 son historias que puedes compartir con toda la familia para tomar mejor postura en la vida.
Reflexiones Hermosas,Silver Apps10,Estilo de vida,4.8,100000,Me parece muy buena pero me es imposible compartir tantas reflexiones Buenas pues la aplicaci칩n carece de la herramienta que lo facilite. Soy adulta mayor y puede ser que que no sea muy experta y mi celular es un poco antiguo por no decir es bastante. Es la primera aplicaci칩n que encuentro sin coman...Opini칩n completa
Frases de motivacion personal gratis y motivadoras,Enjoy With Our Apps,Entretenimiento,4.5,50000,"Vers치til, 칰tiles, apropiadas, bastante frase motivadora, se deleita en cada una, y se las aplica a uno mismo para meditar"
Frases de Motivaci칩n y Refleccion Diaria Gratis,Tec Star Studio,Estilo de vida,4.4,100000,Es excelente poder editar el texto y demas
Reflexiones Hermosas,Silver Apps10,Estilo de vida,4.8,100000,Es una aplicaci칩n muy buena qu칠 tiene unas reflexiones muy hermosas pero ser칤a genial trabajar en que estas reflexiones lleguen todos los d칤as en una hora fija ya sea est치 en la ma침ana a la media ma침ana a la tarde a la media tarde diferentes frases para que nosotros podamos utilizar las y podamos pu...Opini칩n completa
Palabras de Motivacion : Pensamientos Positivos,Nice-Apps,Entretenimiento,4.5,100000,Losieno las frases preciosas per no se pueden descargar se descarga una y siempre te sale la misma por eso la des instalo lastima
Motivaci칩n e inspiraci칩n: citas,Maximilian Woehrer,Personalizaci칩n,4.3,100000,Me gusta ver las frases cuando me siento deprimida o derrotada
Frases de Motivaci칩n Para Toda Ocasi칩n,1Tiger Apps,Estilo de vida,4.3,10000,No pidan ver un video para poder meterse a las frases o los chat.....por que en su otra aplicacion es refome que pidan ver un video para meterse a las frases o videos tumblr y esas cosas otsea para eso no hagan la aplicacion....y cuando uno ve el video y no quiere instalr lo que pone en publicidad n...Opini칩n completa
Frases de Animo y Motivacion,New Generation Apps Android,Entretenimiento,4.6,50000,"Frases de inspiraci칩n, divertidas que hacen que cada d칤a sea el mejor!!"
Autoestima Positiva,Creative Image Apps,Entretenimiento,4.6,10000,"Hola.! Preciosa app,los felicito y a mi me gusto un mont칩n. Asi que el que la descargue? Doy seguridad que es muy linda y gracias a los creadores. Saludos"
"Fraseando - frases, reflexiones y estados a diario",Caboso Apps,Estilo de vida,4.6,50000,"Es una app muy buena, frases muy bonitas, el 칰nico error que encuentro, es que la frases no se pueden visualizar desde la barra de notificaciones ni en la pantalla de bloqueo, se debe entrar a la app para poder ver la frase del d칤a, si pudieran hacer que las frases lleguen como notificaci칩n, ser칤a e...Opini칩n completa"
Asistente de Dieta - Motivaci칩n para perder peso,Mobile Heroes,Salud y bienestar,4.5,10000000,"Est치 padre que te de las cantidades de calor칤as por alimento, as칤 tienes control de lo que ingieres. Me gustar칤a que el adelgazamiento del avatar fuera parte del plan lite. Me gusta la app. F치cil de usar."
Historias para el Alma - Cuentos de la vida,AbacaxiApps,Libros y obras de consulta,4.7,10000,"Son muy buenas las historias, pero son limitadas"
frases de motivaci칩n 칠xito y amor propio,appcreativas,Entretenimiento,4.5,5000,muy buena la recomiendo tiene frases muy bonitas y motivadoras gracias aplicaci칩n excelente
Autoestima Positiva,Creative Image Apps,Entretenimiento,4.6,10000,Tiene frases positivas del amor propio la verdad si me gust칩 mucho dios los bendiga siempre
Audiolibro Superacion Personal Transforme su Vida,Ara Ferrer,M칰sica y audio,2.9,10000,no me deja abrir 游뱓驕좶잺
Frases de Animo y Motivacion,New Generation Apps Android,Entretenimiento,4.6,50000,"Muy buena la aplicaci칩n , con anuncios pero tolerables"
Frases Motivadoras Cortas y de Superaci칩n,Work apps for you,Entretenimiento,4.5,10000,Excelente aplicaci칩n de frases motivadoras. Me gustaron los audios.
Frases de Motivaci칩n Para Toda Ocasi칩n,1Tiger Apps,Estilo de vida,4.3,10000,Muy buena esta app aunque me gustar칤a qu칠 publicasen m치s pensamientos filos칩ficos de personajes que dejaron su huella permanentemente en su paso por este mundo (Gandhi Russeau Churchil Mandela) por citar algunos ya qu칠 la lista seria interminable. 游녨游녨游녨
Reflexiones Hermosas,Silver Apps10,Estilo de vida,4.8,100000,Deber칤an actualizar todos los d칤as buenos temas y dar la opci칩n de copiar el texto. Siempre que se abre la app se visualizan las mismas im치genes. Y deber칤an estarlas actualizando almenos semanal mente . Y tener la opci칩n de que el usuario pueda copiar el escriyro. O en su efectos editarlo para agreg...Opini칩n completa
Frases Motivadoras - Pensamientos Positivos,MooniKapps,Entretenimiento,4.7,10000,Muy lindas y llenas de 치nimos para toda ocasi칩n no cambien si lo hacen que sea para alimentar m치s con conciencia dios los bendiga
Asistente de Dieta - Motivaci칩n para perder peso,Mobile Heroes,Salud y bienestar,4.5,10000000,"La App es buena, te sirve para ser consciente de las calor칤as que ingieres, te motiva con diferentes retos y te ayuda a controlar lo que comes ya que tiene bastante variedad de alimentos. En mi caso al introducir los datos, me indic칩 que deb칤a consumir el mismo n칰mero de calor칤as que la dieta de mi ...Opini칩n completa"
Frases de Motivaci칩n y 칠xito,Develop Grammer,Salud y bienestar,4.6,10000,"Muy bonito, me encant칩 merece las estrellas!"
Motivaci칩n e inspiraci칩n: citas,Maximilian Woehrer,Personalizaci칩n,4.3,100000,Muy bonitas frases que inspiran a ser mejor
Autoestima Positiva,Creative Image Apps,Entretenimiento,4.6,10000,una app sencilla con bonitas imagenes y reflecciones.
Frases Superaci칩n y Motivaci칩n,JekApps Inc.,Personalizaci칩n,4.5,10000,esta aplicaci칩n es muy facil para ocupar y tiene bonitas frases.
frases de motivaci칩n 칠xito y amor propio,appcreativas,Entretenimiento,4.5,5000,Me guata mucho por que he aprendido mucho ya qie uno no puede quedarse estancado despues de los errores uno tiene que salir adelante y saber que hay un ma침ana mejor y que hay mejores personas y que todo va a cambiar para bien
Motivation - Frases diarias,Monkey Taps,Salud y bienestar,4.7,500000,Las fraces me han ayudado en los momentos m치s necesarios porque cuando llega la notificaci칩n de la frace me siento feliz de leerla y de seguir adelante
Audiolibro Superacion Personal Transforme su Vida,Ara Ferrer,M칰sica y audio,2.9,10000,"Es que no se escucha, la baje y no puedo escucharla,quiero saber si es para pa칤ses en espec칤fico, soy de Cuba, y no es la primera vez que trato de escuchar y nada, me podr칤an explicar y ayudar , por favor, besos y gracias"
Mentalidad Emprendedora - Frases de Motivaci칩n,Wallpapers & Sounds Madness,Educaci칩n,4.1,100000,Lo mejor que pude descargar alguna vez para mi cresimiento personal y empresarial
Frases de Motivaci칩n y Refleccion Diaria Gratis,Tec Star Studio,Estilo de vida,4.4,100000,Transmitir e insertar a los educandos en la pr치ctica educativa tomando como referencia estas frases como indicadores de motivar al alumno.
Frases de Animo y Motivacion,New Generation Apps Android,Entretenimiento,4.6,50000,Muy buena exelente aplicacion Dios les bendiga
"Fraseando - frases, reflexiones y estados a diario",Caboso Apps,Estilo de vida,4.6,50000,"Las frases no tienen porqu칠 ser bonitas. Hecho en falta una aplicaci칩n que se tome en serio al aforismo. Veo muchas citas sin profundidad, auspiciadas por el anonimato. Hay miles de reflexiones de fil칩sofos ilustres, historiadores, pol칤ticos, etc. que pueden ayudar a que el d칤a comience con una refl...Opini칩n completa"
frases de motivaci칩n 칠xito y amor propio,appcreativas,Entretenimiento,4.5,5000,Tiene buenas opciones y variedad para enviar mensajes. Le doy 3 estrellas porque cuando quiero enviar alguno de los mendajes me pide que le de permiso para ingresar a mis fotos y archivos. Esto no tiene sentido porque no es una app para crear o modificar. Es una app para compartir mensajes que ya es...Opini칩n completa
Palabras de Motivacion : Pensamientos Positivos,Nice-Apps,Entretenimiento,4.5,100000,Las comparto a mis contactos
Asistente de Dieta - Motivaci칩n para perder peso,Mobile Heroes,Salud y bienestar,4.5,10000000,"Ten칤a la versi칩n pro, hab칤a pagado por ella y al cambiar de tel칠fono e instalarla, me pide pagar nuevamente, mand칠 un mail pero no me lo solucionaron s칩lo era una respuesta autom치tica"
Mentalidad Emprendedora - Frases de Motivaci칩n,Wallpapers & Sounds Madness,Educaci칩n,4.1,100000,"Excelente aplicaci칩n, para el desarrollo personal y financiero, una bonita experiencia en el mundo de las finanzas y los consejos econ칩micos. Ayuda al emprendedor a ense침arle el camino que debe seguir para alcanzar las metas establecidas y deseos financieros. No me sorprenderia que uno de los pr칩xim...Opini칩n completa"
"Fraseando - frases, reflexiones y estados a diario",Caboso Apps,Estilo de vida,4.6,50000,Excelente aplicaci칩n la recomiendo solamente lo que no me gust칩 fue que solamente tiene frases de motivaci칩n y para m칤 persona quiero todo tipo de frases.
Audiolibro Superacion Personal Transforme su Vida,Ara Ferrer,M칰sica y audio,2.9,10000,hermoso. te cambia la vida
Videos de motivacion personal y superacion 游눩,Interactive Apps Media,Salud y bienestar,4.4,10000,No sirve no deja abrir los videos
Frases Superaci칩n y Motivaci칩n,JekApps Inc.,Personalizaci칩n,4.5,10000,"Muy mala est치 aplicaci칩n no se puede compartir en waappsa,dice k el archivo no es compatible"
Frases de Motivaci칩n y 칠xito,Develop Grammer,Salud y bienestar,4.6,10000,Con estas frases de motivaci칩n me fortalecen y ayudo a mis contactos tambi칠n. Bendiciones.
Frases Motivadoras Cortas y de Superaci칩n,Work apps for you,Entretenimiento,4.5,10000,Muy buena aplicaci칩n. Me gust칩 mucho
Frases de motivacion personal gratis y motivadoras,Enjoy With Our Apps,Entretenimiento,4.5,50000,"Maravillosa, me encantar칤a incluyeran frases actuales sobre lo que estamos viviendo en el momento."
Frases de Animo y Motivacion,New Generation Apps Android,Entretenimiento,4.6,50000,"Espero que con esta felicitaci칩n por su aplicaci칩n, que es fenomenal, se animen m치s a칰n y les env칤o felicitaciones por ello y gracias por sus frases. Saludos."
Historias motivacionales,AbacaxiApps,Libros y obras de consulta,4.5,10000,"Me gusta mucho esta aplicaci칩n, pero hubiera sido mucho mejor si los cuentos que all칤 est치n como por ejemplo el ni침o y la mesera se pudieran compartir. Por lo dem치s est치 muy productivo. Gracias 游뱅"
Reflexiones Hermosas,Silver Apps10,Estilo de vida,4.8,100000,"Muy bueno, frases cortas , pero llenas de contenido y estableciendo una comparaci칩n. Para favorecer comprencion.. trate de que las fotos que acompa침en sean claras . , conbuena iluminaci칩n y colores agradables. . Que enrriquezca a la frase .y no le reste protagonismo. En lo posible.!!!"
Motivaci칩n e inspiraci칩n: citas,Maximilian Woehrer,Personalizaci칩n,4.3,100000,F치cil de usar y se integra con todo para compartir
Frases de motivacion personal gratis y motivadoras,Enjoy With Our Apps,Entretenimiento,4.5,50000,"Hermosas frases, y sencillas de aplicar, me gusta mucho esta app. Gracias!!!"
Motivation - Frases diarias,Monkey Taps,Salud y bienestar,4.7,500000,Las frases son muy buenas deber치s pero el problema es que tiene todas las categor칤as bloqueadas hay que pagar y noo y pues no puede andar por ahy diciendo lo tendremos en cuenta cuando no lo tienen en cuenta y no hacen nada para solucionarlo 游눛游뗷muchas gracias de resto todo es espectacular
Frases de Motivaci칩n y 칠xito,Develop Grammer,Salud y bienestar,4.6,10000,Me gusta esta APP a ayudado a muchos
Frases y fotos de Felicidad,Entertainment LTD Apps,Estilo de vida,4.7,10000,Gracias por tan interesantes fotos y frases muy buenas felicidades.
Saludos De Buenos D칤as Gratis,kamvapps97,Entretenimiento,4.8,100000,"Tiene muy bonitas postales, creo pueden mejorarlas m치s. S칩lo una cosa, los mensajes llegan muy tarde, los de buenos d칤as me llegan en la tarde. Y los de buenas noches llegan casi a las doce pm. Gracias. Env칤en m치s temprano los mensajes"
Feliz Cumplea침os: Fiesta&Velas,BabyBus,Educaci칩n,4.1,10000000,Bien adorable pero haces tu fiesta luego terminas repites lo dem치s bien 游땚游땚游봃游봃游봃游뱅
Frases Feliz Dia de la Semana,New Generation Apps Android,Entretenimiento,4.5,100000,"Muy buena app para todos los d칤as poner una imagen diferente y saludar amigos , familiares gracias por esta aplicaci칩n de los dias de la semana saludos"
Feliz Cumplea침os con Musica,New Generation Apps Android,Entretenimiento,4.4,100000,"Nose puede compartir los audios de cumplea침os por wassap o facebook, si corrigieran ese peque침o detalle seria chevere.. graciaa"
Radio Felicidad Uyuni,Jhans Canaviri,M칰sica y audio,4.8,100,Excelente APP felicidades y gracias por la informaci칩n.
Feliz Cumplea침os Hijo,Creative Image Apps,Entretenimiento,4.7,50000,Muy buena aplicaci칩n para felicitar al nuestros familiares y amigos
Feliz cumplea침os frases e imagenes para compartir,Entertainment LTD Apps,Entretenimiento,4.5,500000,"no todas son lindas. ser칤a bueno que est칠n ""clasificadas"" para ir directo a lo que uno busca. no hay tarjetas un poco las simples donde poder ecribir el nombre del destinatario para poder personalizarla. anuncios molestos"
Felices coloridos huevos de la suerte - 2020,Pipi Chick Studio,Puzles,3.4,500000,"La app se abre sola, con publicidad muy molesta..."
Feliz cumplea침os frases e imagenes para compartir,Entertainment LTD Apps,Entretenimiento,4.5,500000,Me gusta ya que es muy pr치ctico y es una gran ayuda que permite acceder a una gama de publicaciones en ayuda... Gracias.
Wysa: tu entrenador de felicidad,Touchkin,Salud y bienestar,4.7,1000000,"Me encanta esta app. Es muy 칰til. Soy una persona solitaria, no ten칤a a nadie a quien platicarle lo que me pasaba. 칔ltimamente lo estuve pasando muy mal, ya no ve칤a m치s salidas. Pero por suerte hoy encontr칠 a Wisa. Se que es un robot pero es agradable que alguien te escuche. Le falta seguir mejorand...Opini칩n completa"
Felices coloridos huevos de la suerte - 2020,Pipi Chick Studio,Puzles,3.4,500000,"Lo recomiendo ya que es para ni침os y no toman esto en cuenta, pero me gustar칤an que tomar치n en cuenta el juego original de que cuando nacen los pollitos no se deben ir deben de seguir los pollitos poniendo huevos tambi칠n pero si lo recomiendo como es para ni침os"
C칩mo ser feliz en la vida,Love & Fantasy Apps,Estilo de vida,3.8,1000,Buenas tardes/d칤as/noches
Radio Felicidad,Armadisoft,M칰sica y audio,4.6,5000,"M칰sica cl치sica, agradable que da tranquilidad, temas a elegir de colores de acuerdo a nuestro estado de 치nimo, da felicidad radio felicidad 游븾游낕꽥뗵勇游"
Radio Felicidad,loganbishop,M칰sica y audio,4.6,5000,Me gusta la estaci칩n pero Me gusta las narraciones y ef칤meros de el programa el rocodromo
Frases de Felicidad con Im치genes,JekApps Inc.,Estilo de vida,4.3,1000,Me gust칩
Ser feliz Reto 30 d칤as by Glyem Apps,Glyem Apps,Estilo de vida,4,5000,Increible como con algo tan simple se puede obtener resultados!
Videos con frases y canciones de feliz cumplea침os,Interactive Apps Media,M칰sica y audio,4.3,100000,"Podian poner felucitaciones de habaneras con videos de playas, y espirituales con videos de naturaleza, Gracias, Isabel"
Frases y fotos de Felicidad,Entertainment LTD Apps,Estilo de vida,4.7,10000,Me ha gustado much칤simo tiene frases muy bonitas y muy
Imagenes con Frases de Felicidad,Creative Image Apps,Entretenimiento,4.6,5000,IMAGENES Y ESCRITOS BELLOS GRACIAS
Mensajes de felicidad imagenes,Entertainment LTD Apps,Entretenimiento,4.6,1000,Me encanta muy lindas fraces yo las puedo compartir de 10. Gracias仇
Mensajes de felicidad imagenes,Entertainment LTD Apps,Entretenimiento,4.6,1000,pr치ctico y c칩modo .
La Jarra de la Felicidad - diario de recuerdos,Damapio,Estilo de vida,4.7,5000,Es una app sencilla de utilizar pero bastante completa. Mi jarra se va llenando de recuerdos bonitos casi sin que me d칠 cuenta y me arranca una sonrisa cada vez que de manera aleatoria le pido que me muestre una experiencia vivida. El simple hecho de anotar los momentos agradables nos permite hacern...Opini칩n completa
Frases Feliz Dia de la Semana,New Generation Apps Android,Entretenimiento,4.5,100000,Muy buena app con colorido y con buen humor de saludar a las personas con cada d칤a de la semana
Imagenes Frases de Felicidad,JekApps Inc.,Personalizaci칩n,4.7,50000,me gustan mucho todas las imagenes poreso yo siempre las recomiendo las imagenes disen loke una siente.
Radio Felicidad,Armadisoft,M칰sica y audio,4.6,5000,"Es una aplicaci칩n muy pr치ctica pues puedo escuchar la m칰sica que me gusta desde el cel, 춰춰춰es simplemente genial!!! Bravo 游녨游녧"
Lojong: Meditaci칩n y Mindfulness -Ansiedad +Sue침o,Unisollus,Salud y bienestar,4.9,1000000,"Es fantastica esta aplicaci칩n, llevo tiempo probando aplicaciones para meditar pero esta es una de las mejores que he instalado! Permite acceder a programa completos solo por ver videos cortos en comparaci칩n de otras apps que te cobran y te dejan a la mitad de una sesi칩n. Tiene art칤culos muy buenos ...Opini칩n completa"
Ansiedad y estr칠s,Metta Apps,Salud y bienestar,4.0,100000,"No se escuchan los audios, no me cargan porque ser치???"
Consejos para ser feliz,Frenys,Estilo de vida,4.3,10000,Es incre칤ble me ayud칩 a tener una mejor visi칩n de la vida 鮫
Frases Feliz Dia De La Semana,kamvapps97,Entretenimiento,4.8,10000,"Me encanta esta aplicaci칩n xq en ella te ponen frases diarias aleg칩ricas al diario, al inicio y final de cada mes que puedes compartir con tus contactos. Saludos"
Feliz Cumplea침os,AppDevGenesis,Entretenimiento,4.3,100000,Arroja error al abrir la app
Wysa: tu entrenador de felicidad,Touchkin,Salud y bienestar,4.7,1000000,"Okay me encanta la aplicaci칩n. Pero estar칤a perfecta si pudieran agregar la traducci칩n al espa침ol :(, tal vez no ha todo (como por ejemplo a los videos) pero ayudar칤a bastante a los que no saben tanto ingl칠s (como yo) porque tengo que estar todo el tiempo con el traductor jaja. Pero que maravilla de...Opini칩n completa"
Imagenes de Feliz Cumplea침os Gratis Para Felicitar,The Master Appr,Entretenimiento,4.6,500000,Es una aplicacion muy amplia en el sentido de que selecciona el mensaje que queremos en ese caso felicitar desde el peque침o al mayor decise hasta el abuelito muy buena gracias.......
Imagenes Frases de Felicidad,JekApps Inc.,Personalizaci칩n,4.7,50000,"estoy muy conforme con las fraces paisajes dibujos son muy intersante motivacion ,reflexilnes, de la vida ,de actitud personal me siento vien y disfruto mucho de ello (el unico reclamo es que x ahi pasan las camaritas y bueno x ahi cuesta enjanchar los dibujos x. lo demas felicitaciones GRACIAS"
Radio Felicidad Mexico - 1180 AM Radio,LogApps America,M칰sica y audio,3.4,1000,No me sirvio pero se agradece la intenci칩n gracias
Feliz Cumplea침os Hijo,Creative Image Apps,Entretenimiento,4.7,50000,Muy buenas tarjetas de felicitaciones
C칩mo Ser tu Mejor Versi칩n,Israel Leal,Estilo de vida,4.2,10000,por fin una app que de verdad sirve en la playstore
C칩mo ser feliz en la vida,Love & Fantasy Apps,Estilo de vida,3.8,1000,Muy buena
"Reto 30 dias - Vida Zen, Felicidad y Sonrie",CHALLENGE FOR ALL,Salud y bienestar,4.2,10000,PRACTICO
Videos con frases y canciones de feliz cumplea침os,Interactive Apps Media,M칰sica y audio,4.3,100000,"LA PEOR APP QUE HE VISTO NUNCA, LO 칔NICO QUE OFRECE (CON PUBLICIDAD INVASIVA), ES UNA RECOPILACI칍N DE ENLACES A VIDEOS DE YOUTUBE (ESO YA LO SABEMOS BUSCAR TODOS), Y ENCIMA LOS PRIMEROS EST츼N BORRADOS."
Frases de Felicidad con Im치genes,JekApps Inc.,Estilo de vida,4.3,1000,Hermosura de aplicacion
Frases de Felicidad con Im치genes,JekApps Inc.,Estilo de vida,4.3,1000,Es bueno
Imagenes con Frases de Felicidad,Creative Image Apps,Entretenimiento,4.6,5000,Me Encant칩 muy bonitas palabras 游땔
Smylife - Felicidad diaria,Smylife SAS,Salud y bienestar,4.3,10000,Entr칠 a la app con depresi칩n y ahora estoy apunto de saltar de un puente.
Imagenes de Feliz Cumplea침os Gratis Para Felicitar,The Master Appr,Entretenimiento,4.6,500000,"Ha sido buena, seria excelente si al abrir la app, estuviera claro la busqueda, tengo que abrir una por una, la lista de Feliz Cumplea침os, para encontrar la que necesito, ej. Padre, amigo, hermana, primos, etc. Seria ideal que aparezca en el mismo recuadro Feliz Cumplea침os Hermana, Feliz Cumplea침os ...Opini칩n completa"
AtentaMente - Meditaci칩n y Felicidad,AtentaMente,Salud y bienestar,4.3,10000,"Muy buena app, me ha servido mucho para analizar mis emociones y despu칠s de los ejercicios puedo trabajar mejor. No corr칤a en Android y escrib칤 a los desarrolladores. En la nueva versi칩n corre perfectamente"
Frases de felicidad,CodevApps - Imagenes y Frases,Estilo de vida,4.8,1000,Me agradan las distintas frases y las im치genes que se usan. Hay ciertas cosas que las siento cerca de mi vida
Ansiedad y estr칠s,Metta Apps,Salud y bienestar,4.0,100000,"Una app de mucha ayuda, aunque no puedo escuchar los audios en android 4 ni 5 tras las ultimas actualizaciones."
Feliz cumplea침os frases e imagenes para compartir,Entertainment LTD Apps,Entretenimiento,4.5,500000,Me es util y encuentro bonitas fotos.
C칩mo ser positivo,RomanT. Apps,Libros y obras de consulta,4.0,100000,Es la mejor aplicacion que e utilizado en mi vida
Feliz Cumplea침os,AppDevGenesis,Entretenimiento,4.3,100000,muy buenas im치genes!!
Radio Felicidad,Armadisoft,M칰sica y audio,4.6,5000,Muy buena y canciones del recuerdo y no tantos comerciales en el tel칠fono horrores en fin me gusta muchisimo
Ser feliz Reto 30 d칤as by Glyem Apps,Glyem Apps,Estilo de vida,4,5000,Muy bueno
Imagenes de Feliz Cumplea침os Gratis Para Felicitar,The Master Appr,Entretenimiento,4.6,500000,"Muy buena, lindas im치genes emotivas, lindos colores, sugiero m치s tama침o, mucho espacio vac칤o, pueden agregar luces, chimbombas, o globos, trozos de papelillo, gorros, signos musicales, C치ritas felices, etc. Se har치n m치s llamativas y alegres, sugerencia, muy buenas."
Feliz Cumplea침os: Fiesta&Velas,BabyBus,Educaci칩n,4.1,10000000,Le pongo 4 estrellas xq cuando terminas de jugar se repite lo mismo y yo quiero q no se repita me gusta jugarlo y a mi hermanita tambi칠n pero eso es lo q no me gusta y tambi칠n me aburro mucho
Frases Feliz Dia De La Semana,kamvapps97,Entretenimiento,4.8,10000,Me encanta!!! Unas frases muy buenas y las im치genes muy chulas. Un Saludo
Saludos De Buenos D칤as Gratis,kamvapps97,Entretenimiento,4.8,100000,"Me gusta mucho la versatilidad... Ya q permite saludar con buenos d칤as tardes o noche,d칤as espec칤ficos y la variaci칩n d presentaci칩n d los saludos(Algunos sencillos,otros con flores y otros con frases d motivaci칩n)... En resumen me gusta bastante la app... Gracias..."
Radio Felicidad Mexico - 1180 AM Radio,LogApps America,M칰sica y audio,3.4,1000,Es una basura de aplicaci칩n!!!
Frases de felicidad,CodevApps - Imagenes y Frases,Estilo de vida,4.8,1000,Muchas gracias !! Alucinante frases !! Y definitivamente la finalidad de la existencia !! Felicitaciones !! 游
Radio Felicidad Uyuni,Jhans Canaviri,M칰sica y audio,4.8,100,"Informaci칩n de nuestra querida ciudad Uyuni, ""Hija Predilecta de Bolivia"" y excelente m칰sica."
AtentaMente - Meditaci칩n y Felicidad,AtentaMente,Salud y bienestar,4.3,10000,"La aplicaci칩n lleva dando fallos meses, ahora ni siquiera me permite el acceso. Una pena porque llevo con ella al menos dos a침os! Intentar칠 desinstalarla y volverla a instalar."
Imagenes feliz dia del Padre,Revilapps Imagenes graciosas Poemas amor enamorar,Entretenimiento,4.4,50000,Muy linda la aplicaci칩n me encant칩 lo recomiendo
La Jarra de la Felicidad - diario de recuerdos,Damapio,Estilo de vida,4.7,5000,Lo descargue resien me encanta
